{"type": "blog", "blog_name": "آپ تی وی تک", "blog_url": "http://uptv1.blog.ir/", "post_url_1": "http://uptv1.blog.ir/1396/11/05/%D8%AF%D8%A7%D9%86%D9%84%D9%88%D8%AF-%D8%A7%D9%86%DB%8C%D9%85%DB%8C%D8%B4%D9%86-%D8%AF%D8%B1%D8%A7%DA%A9%D9%88%D9%84%D8%A7%DB%8C-%DA%A9%D9%88%DA%86%DA%A9-The-Little-Vampire-2018-%D8%A8%D8%A7-%D8%AF%D9%88%D8%A8%D9%84%D9%87-%D9%81%D8%A7%D8%B1%D8%B3%DB%8C-%D9%88-%DA%A9%DB%8C%D9%81%DB%8C%D8%AA-%D8%B9%D8%A7%D9%84%DB%8C", "post_title_1": "دانلود انیمیشن دراکولای کوچک The Little Vampire 2018 با دوبله فارسی و کیفیت عالی", "post_content_1": "\nدانلود انیمیشن دراکولای کوچک The Little Vampire 2018 با دوبله فارسی و کیفیت عالی\n\n\n\nنام اثر: دراکولای کوچک The Little Vampire 2017\nکیفیت: DVDRip – \nژانر: انیمیشن\nمخاطب:  همه گروه های سنی\nمحصول: کشور آمریکا\nزبان: فارسی (دوبله)\nسال تولید: 2015\nمدت زمان: 92 دقیقه\nداستان انیمیشن :رودولف ، خون آشام 13 ساله که قبیله اش توسط یک شکارچی خون آشام بد نام تهدید می شود با تونی ملاقات می کند و …\n\n\nادامه مطلب", "post_url_2": "http://uptv1.blog.ir/1396/11/04/%D8%AF%D8%A7%D9%86%D9%84%D9%88%D8%AF-%D9%81%DB%8C%D9%84%D9%85-%D9%85%D8%A7%D9%84%D8%A7%D8%B1%DB%8C%D8%A7-%D8%B1%D8%A7%DB%8C%DA%AF%D8%A7%D9%86", "post_title_2": "دانلود فیلم مالاریا  رایگان", "post_content_2": "\nدانلود فیلم مالاریا با کیفیت ۱۰۸۰p و لینک مستقیم\n\n\n\n\n\nنام اثر: مالاریا\nکیفیت ها: full hd 1080p – hd 720p – sd 480p – \nمخاطب: بزرگسالان\nنوع فیلم: سینمایی\nمحصول: ایران\nموضوع: اجتماعی\nنویسنده و کارگردان: پرویز شهبازی\nتهیه کنندگان: مسعود ردایی\nبا هنرنمایی:  ساعد سهیلی، ساغر قناعت، آذرخش فراهانی (برادر گلشیفته)، آزاده نامداری، سیامک ادیب، علیرضا استادی و…\nسال تولید: 1394\nتاریخ انتشار: 1396\nمدت زمان: 95 دقیقه\nخلاصه داستان:\nدرباره دختری بنام حنا (ساغر قناعت) و پسری بنام مرتضی (ساعد سهیلی) است که در تهران گردی‌های خود با مردی برخورد می‌کنند که مشکلی دارد. آن‌ها سعی می‌کنند راه حلی برای این مشکل پیدا کنند و…\n\n\nادامه مطلب", "post_url_3": "http://uptv1.blog.ir/1396/11/02/%D8%AF%D8%A7%D9%86%D9%84%D9%88%D8%AF-%D8%B3%D8%B1%DB%8C%D8%A7%D9%84-%D8%B3%D9%82%D9%88%D8%B7-%D8%B4%D9%88%D8%A7%D9%84%DB%8C%D9%87-%D9%87%D8%A7-Knightfall-%D8%A8%D8%A7-%D8%B2%DB%8C%D8%B1%D9%86%D9%88%DB%8C%D8%B3-%D9%81%D8%A7%D8%B1%D8%B3%DB%8C", "post_title_3": "دانلود سریال سقوط شوالیه ها Knightfall با زیرنویس فارسی", "post_content_3": "دانلود سریال سقوط شوالیه ها Knightfall با زیرنویس فارسی\nکیفیت HD 720p ، HD 1080p – سانسور شده\n\nدانلود سریال سقوط شوالیه ها Knightfall\nاین سریال زیرنویس فارسی و سانسور شده و هیچ گونه صحنه غیر اخلاقی و مغایر با شئونات اسلامی ندارد.\nنام اثر: سریال سقوط شوالیه ها Knightfall\nکیفیت: HD 720p ، HD 1080p – \nامتیاز: IMDb 6.3/10\nمخاطب:  تماشای این فیلم به افراد زیر 13 سال توصیه نمی شود.\nمحصول: آمریکا دانلود سریال سقوط شوالیه ها\nموضوع: تاریخی | درام | اکشن | ماجراجوی\nکارگردان: Douglas Mackinnon\nستارگان : Tom Cullen , Jim Carter , Pádraic Delaney , Simon Merrells , Julian Ovenden , Olivia Ross ,Ed Stoppard ,Sabrina Bartlett ,Bobby Schofield ,Sarah Sofie Boussnina\nزبان: انگلیسی (زیرنویس)\nمدت زمان: هر قسمت میانگین 50 دقیقه\nسال تولید: 2017 – ادامه دارد\nتاریخ انتشار: 2017 – ادامه دارد\nداستان سریال:\nپس از اینکه شوالیه های تمپلار که سال ها در راس قدرت بودند با شکست آخرین سنگرشان، ایکر، از صحنه کنار رفتند شایعه شد که جام مقدس در همان مکان گم شده و گروهی برای بدست آوردندش به آنجا باز میگردند…\n\n\nادامه مطلب", "post_url_4": "http://uptv1.blog.ir/1396/11/01/%D8%AF%D8%A7%D9%86%D9%84%D9%88%D8%AF-%D9%81%DB%8C%D9%84%D9%85-%D9%BE%D8%B1%D8%AA%D9%82%D8%A7%D9%84-%D8%AE%D9%88%D9%86%DB%8C", "post_title_4": "دانلود فیلم پرتقال خونی", "post_content_4": "\nدانلود فیلم پرتقال خونی با کیفیت اورجینال و لینک مستقیم – کیفیت 720P\n\n\nبه درخواست کاربران با کیفیتی متفاوت\n\n.\nمخاطب: عام\nکیفیت : 720 – \nنام اثر: پرتقال خونی\nمحصول: ایران\nکارگردان: سیروس الوند\nبازیگران: فریبرز عرب نیا، حامد بهداد، نیوشا ضیغمی، ویشکا آسایش، آهو خردمند، زیبا برفه\nمدت زمان: 105 دقیقه\nسال تولید: 1389\n.\nخلاصه داستان: والا رادمنش که در آستانه جدایی از همسرش است. در این بین دختر جوانی به نام ترمه برای طراحی دکور به دفتر کار او می آید و رفته رفته این آشنایی به شکل گیری رابطه ای عاطفی می انجامد. والا که زخم خورده از زندگی مشترک است با احتیاط و کمی بد بینانه در این رابطه پیش می رود تا اینکه شخصی به نام سیاوش قدم در زندگی ترمه می گذارد و…\n\n\nادامه مطلب", "post_url_5": "http://uptv1.blog.ir/1396/11/01/%D8%AF%D8%A7%D9%86%D9%84%D9%88%D8%AF-%D9%81%DB%8C%D9%84%D9%85-Snowpiercer-2013-%D9%82%D8%B7%D8%A7%D8%B1-%DB%8C%D8%AE-%D8%B4%DA%A9%D9%86", "post_title_5": "دانلود فیلم Snowpiercer 2013 قطار یخ شکن", "post_content_5": "\nدانلود فیلم Snowpiercer 2013 قطار یخ شکن با دوبله فارسی و کیفیت عالی\n\n\nکیفیت HD 1080p , HD 720p – سانسور شده\n\nاین فیلم دوبله فارسی و سانسور شده و هیچ گونه صحنه غیر اخلاقی و مغایر با شئونات اسلامی ندارد.\nنام اثر: فیلم قطار یخ شکن Snowpiercer\nکیفیت: HD 1080p , HD 720p – \nامتیاز: IMDb 7/10\nژانر: اکشن | علمی تخیلی\nمخاطب:  تماشای این فیلم به افراد زیر 13 سال توصیه نمی شود.\nنوع فیلم: سینمایی\nمحصول: آلمان\nکارگردان: Bong Joon ho\nستارگان:Chris Evans , Tilda Swinton , Song Kang‑Ho , Jamie Bell , John Hurt\nسال تولید: 2013 میلادی\nزبان: فارسی (دوبله)\nمدت زمان: 120 دقیقه\nداستان فیلم:\nدر آینده وقتی که یک آزمایش برای تغییر آب وهوای زمین شکست میخورد و حیات بشر به جز عده ای محدود از بین میرود و آنها در قطاری به سرتاسر دنیا حرکت میکنند .\n\n \n\n\nادامه مطلب", "post_full_content_5": "\n\nدانلود فیلم Snowpiercer 2013 قطار یخ شکن\n\n\n\n\n\nدانلود فیلم Snowpiercer 2013 قطار یخ شکن با دوبله فارسی و کیفیت عالی\n\n\nکیفیت HD 1080p , HD 720p – سانسور شده\n\nاین فیلم دوبله فارسی و سانسور شده و هیچ گونه صحنه غیر اخلاقی و مغایر با شئونات اسلامی ندارد.\nنام اثر: فیلم قطار یخ شکن Snowpiercer\nکیفیت: HD 1080p , HD 720p – \nامتیاز: IMDb 7/10\nژانر: اکشن | علمی تخیلی\nمخاطب:  تماشای این فیلم به افراد زیر 13 سال توصیه نمی شود.\nنوع فیلم: سینمایی\nمحصول: آلمان\nکارگردان: Bong Joon ho\nستارگان:Chris Evans , Tilda Swinton , Song Kang‑Ho , Jamie Bell , John Hurt\nسال تولید: 2013 میلادی\nزبان: فارسی (دوبله)\nمدت زمان: 120 دقیقه\nداستان فیلم:\nدر آینده وقتی که یک آزمایش برای تغییر آب وهوای زمین شکست میخورد و حیات بشر به جز عده ای محدود از بین میرود و آنها در قطاری به سرتاسر دنیا حرکت میکنند .\n\n \n\n\n\n\nلینک های دانلود با دوبله فارسیمنبع : سایت آپ تی وی\n\n\n\nکیفیت : 1080P ، فرمت : mkv ، حجم فیلم : 1.72 گیگابایتکیفیت 1080pکیفیت 1080p (سرور دوم)اسکرین شات\n\n\nکیفیت : 720P ، فرمت : mkv ، حجم فیلم : 1 گیگابایتکیفیت 720Pکیفیت 720P (سرور دوم)\n\n\n\n\nادامه مطلب\n\n\n\nتاریخ : يكشنبه, ۱ بهمن ۱۳۹۶، ۱۰:۱۶ ق.ظ\n\nموضوع :دسته:\n خارجی  ,\n\nبازدید : ۱۴ بار\nنظرات : ۰\n\n\n\n۰\n\n-\n\n\n۰\n\n\n\n\n\n\n\nدیدگاه کاربران\n\n\n\n\n\n\nدیدگاه ارسال شده توسط شما ، پس از تایید توسط مدیران سایت منتشر خواهد شد.\nدیدگاهی که به غیر از زبان فارسی یا غیر مرتبط با مطلب باشد منتشر نخواهد شد.\n\n\n\nارسال نظر آزاد است، اما اگر قبلا در بیان ثبت نام کرده اید می توانید ابتدا وارد شوید.\n\n\n\nنام *\n\n\n\n\n\n\n\nپست الکترونيک\n\n\n\n\n\n\n\nسایت یا وبلاگ\n\n\n\n\n\n\n\n\nپیام *\n\n\n\nشما میتوانید از این تگهای html استفاده کنید:   b یا strong، em یا i، u، strike یا s، sup، sub،  blockquote، code، pre، hr، br، p، a href=\"\" title=\"\"، span style=\"\"، div align=\"\"\n\n\n\n\n\nکد امنیتی *\n\n\n\n\n\n\nارقام فارسی و انگلیسی پذیرفته می‌شوند\n\n\n\n\n\nنظر بصورت خصوصی ارسال شود\nنظر شما به هیچ وجه امکان عمومی شدن در قسمت نظرات را ندارد، و تنها راه پاسخگویی به آن نیز از طریق پست الکترونیک می‌باشد. بنابراین در صورتیکه مایل به دریافت پاسخ هستید، پست الکترونیک خود را وارد کنید.\n\n\n\n\n\n\nپست الکترونیک برای عموم قابل مشاهده باشد\nاخطار!\n\n\n\n\n\n\n\n\n\n\n\n\n\n\n\nدسته بندی\n\n\n\n\nسریال ایرونی طنز\n\n\nسریال سه در چهار\n\n\n\n\nسریال شبهای برره\n\n\n\n\nسریال ساخت ایران\n\n\n\n\nسریال متهم گریخت\n\n\n\n\nسریال خوش نشین ها\n\n\n\n\n\n\nنوستالژی\n\n\nکارتون پسر شجاع\n\n\n\n\nقصه های تابه تا\n\n\n\n\nکارتون سندباد\n\n\n\n\nفیلم خاطره  انگیزه دزد عروسک ها\n\n\n\n\nکلاه قرمزی94\n\n\n\n\n\n\nفیلم ها\n\n\nایرانی\n\n\n\n\nخارجی\n\n\n\n\n\n\nسریال ها\n\n\nسریال ایرانی\n\n\n\n\nسریال خارجی\n\n\n\n\n\n\nانیمیشن\n\n\n\n\n\n\n\n\nآرشیو\n\n\n\nبهمن ۱۳۹۶\nدی ۱۳۹۶\nآذر ۱۳۹۶\nآبان ۱۳۹۶\n\n\n\n\n\nنویسندگان\n\n\n\n\n\nپژمان حیدری\n\n\n\n\n\n\n\nآخرین مطالب\n\n\n\n\n\n دانلود انیمیشن دراکولای کوچک The Little Vampire 2018 با دوبله فارسی و کیفیت عالی\n\n\n\n\n دانلود فیلم مالاریا  رایگان\n\n\n\n\n دانلود سریال سقوط شوالیه ها Knightfall با زیرنویس فارسی\n\n\n\n\n دانلود فیلم پرتقال خونی\n\n\n\n\n دانلود فیلم Snowpiercer 2013 قطار یخ شکن\n\n\n\n\n دانلود فیلم نقش‎نگار با کیفیت HD\n\n\n\n\n دانلود فیلم عصر یخبندان با کیفیت HD\n\n\n\n\n دانلود فیلم خون بازی با لینک مستقیم\n\n\n\n\n دانلود فیلم یکی از ما دو نفر با لینک مستقیم و کیفیت عالی\n\n\n\n\n دانلود فیلم آدمکش با لینک مستقیم\n\n\n\n\n\n\n\nپربازدید ترین ها\n\n\n\n\n\n دانلود سریال طنز چار دیواری با کیفیت عالی و لینک مستقیم_تک فیلم\n\n\n\n\n دانلود سریال تلویزیونی “پس از باران” با کیفیت عالی\n\n\n\n\n دانلود فیلم رویای خیس با کیفیت عالی و لینک مستقیم\n\n\n\n\n دانلود رایگان سریال مرد هزار چهره با کیفیت عالی HD\n\n\n\n\n دانلود سریال ایرانی خوش نشین ها\n\n\n\n\n دانلود سریال زیبا ی قرارگاه مسکونی\n\n\n\n\n دانلود سریال خط قرمز با لینک مستقیم\n\n\n\n\n دانلود رایگان سریال جایزه بزرگ با کیفیت عالی\n\n\n\n\n دانلود رایگان سریال مرد دو هزار چهره با کیفیت عالی\n\n\n\n\n دانلود فیلم تو و من با کیفیت HD و لینک مستقیم\n\n\n\n\n\n\n\n\n\nدرخواست آهنگ مجاز\nآهنگ مورد نیاز خود را درخواست کنید.\n\n\n\n\nآمار سایت\n\n\n\n \n \n \n \n \n \n \n \n\n\n\n\nفیسبوک\nگوگل پلاس\nیاهو\n\n\n\nتبلیغات متنی\n\n\n\n\n\n\n\n\n\n\n\n\nبرچسب ها tags\n\nسایت آپ تی وی1\nسایت دانلود فیلم\nسایت دانلود فیلم ایرانی\nدانلود فیلم سینمایی جدید\nuptv1.blog.ir\nدانلود فیلم ایرانی جدید\nدانلود فیلم های علی صادقی\nسایت فیلم و سریال\nسایت طنز ایرونی\nدانلود فیلم های محمد رضا گلزار\nدانلود فیلم جدید ایرانی\nدانلود فیلم طنز\nسایت فیلم سریال\nدانلود فیلم های سحر قریشی\nدانلود فیلم های رضا عطاران\nدانلود فیلم ایرانی\nدانلود فیلم های بهرام رادان\nدانلود فیلم های الناز شاکردوست\nدانلود فیلم کمدی\nسایت فیلم وسریال\nدانلود سریال ایرانی\nدانلود فیلم های امین حیایی\nسایت دانلود فیلم خارجی\nدانلود فیلم رایگان\nدانلود فیلم دوبله فارسی\nدانلود فیلم عشقی\nدانلود فیلم های مهران غفوریان\nدانلود فیلم های جواد رضویان\nدانلود سریال های مهران مدیری\nدانلود فیلم با حجم کم\n\n\n\nدرباره سایت تماس با ما\n\nسایت دانلود فیلم و سریال ایرانی                                                                            http:// .uptv1blog.ir\n\n\n\n\n\n\nupdateSearchBoxTheme('srchBx')\n\n\n\n\t\t\t\tدنبال کنندگان\n\t\t\t\t\n\t\t\t\t\t\t۹\n\t\t\t\t\tنفر\n\t\t\t\t\n\n\n\n\n\n\n\n\n\n\n\n\n\n\n\n\n\n\n\n\n\n\n\n\n\n\n\n\n\n\n\n\n\t\t\t\tاین وبلاگ را دنبال کنید\n\t\t\t\n\n\n\n\n\nلینک دوستان ارسال لینک\n\n تبادل لینک رایگان\n ساخت وبلاگ جدید در blog.ir\n دانلود فیلم و سریال\nدانلود آهنگ جدید\n\n\n\nصفحات جداگانه آرشیو\n\n\nدانلود سریال طنز ایرونی\n\n\nدانلود انیمیشن دوبله فارسی\n\n\nنوستالژی\n\n\nدانلود سریال متهم گریخت\n\n\nدانلود فیلم سینمایی خارجی\n\n\nدانلود سریال خط قرمز\n\n\nدانلود فیلم کمدی ایرانی\n\n\nدانلود سریال سه در چهار\n\n\nفیلم و سریال\n\n\n\n\n\n\n\nتمامی حقوق مطالب برای آپ تی وی تک محفوظ است و هرگونه کپی برداری بدون ذکر منبع ممنوع می باشد.\nترجمه قالب توسط هایپرتمپ و قالب بیان صورت گرفته است و هرگونه کپی برداری از قالب پیگرد قانونی خواهد داشت.\n\nصفحه اصلی ،\nنقشه سایت ،\nطراح قالب ،\nمترجم قالب،\nقالب بیان\n\n\n\n\n\nعضویت در کانال تلگرام هکس دانلود (کلیک کنید)", "post_full_content_4": "\n\nدانلود فیلم پرتقال خونی\n\n\n\n\n\nدانلود فیلم پرتقال خونی با کیفیت اورجینال و لینک مستقیم – کیفیت 720P\n\n\nبه درخواست کاربران با کیفیتی متفاوت\n\n.\nمخاطب: عام\nکیفیت : 720 – \nنام اثر: پرتقال خونی\nمحصول: ایران\nکارگردان: سیروس الوند\nبازیگران: فریبرز عرب نیا، حامد بهداد، نیوشا ضیغمی، ویشکا آسایش، آهو خردمند، زیبا برفه\nمدت زمان: 105 دقیقه\nسال تولید: 1389\n.\nخلاصه داستان: والا رادمنش که در آستانه جدایی از همسرش است. در این بین دختر جوانی به نام ترمه برای طراحی دکور به دفتر کار او می آید و رفته رفته این آشنایی به شکل گیری رابطه ای عاطفی می انجامد. والا که زخم خورده از زندگی مشترک است با احتیاط و کمی بد بینانه در این رابطه پیش می رود تا اینکه شخصی به نام سیاوش قدم در زندگی ترمه می گذارد و…\n\n\n. دانلود فیلم پرتقال خونی با کیفیت اورجینال\n\nدانلود فیلم پرتقال خونی با کیفیت اورجینال و لینک مستقیم\n حجم: 881 مگابایت\nادامه مطلب\n\n\n\nتاریخ : يكشنبه, ۱ بهمن ۱۳۹۶، ۰۷:۲۱ ب.ظ\n\nموضوع :دسته:\n فیلم ها  ,\n ایرانی  ,\n\nبازدید : ۳۴ بار\nنظرات : ۰\n\n\n\n۰\n\n-\n\n\n۰\n\n\n\n\n\n\n\nدیدگاه کاربران\n\n\n\n\n\n\nدیدگاه ارسال شده توسط شما ، پس از تایید توسط مدیران سایت منتشر خواهد شد.\nدیدگاهی که به غیر از زبان فارسی یا غیر مرتبط با مطلب باشد منتشر نخواهد شد.\n\n\n\nارسال نظر آزاد است، اما اگر قبلا در بیان ثبت نام کرده اید می توانید ابتدا وارد شوید.\n\n\n\nنام *\n\n\n\n\n\n\n\nپست الکترونيک\n\n\n\n\n\n\n\nسایت یا وبلاگ\n\n\n\n\n\n\n\n\nپیام *\n\n\n\nشما میتوانید از این تگهای html استفاده کنید:   b یا strong، em یا i، u، strike یا s، sup، sub،  blockquote، code، pre، hr، br، p، a href=\"\" title=\"\"، span style=\"\"، div align=\"\"\n\n\n\n\n\nکد امنیتی *\n\n\n\n\n\n\nارقام فارسی و انگلیسی پذیرفته می‌شوند\n\n\n\n\n\nنظر بصورت خصوصی ارسال شود\nنظر شما به هیچ وجه امکان عمومی شدن در قسمت نظرات را ندارد، و تنها راه پاسخگویی به آن نیز از طریق پست الکترونیک می‌باشد. بنابراین در صورتیکه مایل به دریافت پاسخ هستید، پست الکترونیک خود را وارد کنید.\n\n\n\n\n\n\nپست الکترونیک برای عموم قابل مشاهده باشد\nاخطار!\n\n\n\n\n\n\n\n\n\n\n\n\n\n\n\nدسته بندی\n\n\n\n\nسریال ایرونی طنز\n\n\nسریال سه در چهار\n\n\n\n\nسریال شبهای برره\n\n\n\n\nسریال ساخت ایران\n\n\n\n\nسریال متهم گریخت\n\n\n\n\nسریال خوش نشین ها\n\n\n\n\n\n\nنوستالژی\n\n\nکارتون پسر شجاع\n\n\n\n\nقصه های تابه تا\n\n\n\n\nکارتون سندباد\n\n\n\n\nفیلم خاطره  انگیزه دزد عروسک ها\n\n\n\n\nکلاه قرمزی94\n\n\n\n\n\n\nفیلم ها\n\n\nایرانی\n\n\n\n\nخارجی\n\n\n\n\n\n\nسریال ها\n\n\nسریال ایرانی\n\n\n\n\nسریال خارجی\n\n\n\n\n\n\nانیمیشن\n\n\n\n\n\n\n\n\nآرشیو\n\n\n\nبهمن ۱۳۹۶\nدی ۱۳۹۶\nآذر ۱۳۹۶\nآبان ۱۳۹۶\n\n\n\n\n\nنویسندگان\n\n\n\n\n\nپژمان حیدری\n\n\n\n\n\n\n\nآخرین مطالب\n\n\n\n\n\n دانلود انیمیشن دراکولای کوچک The Little Vampire 2018 با دوبله فارسی و کیفیت عالی\n\n\n\n\n دانلود فیلم مالاریا  رایگان\n\n\n\n\n دانلود سریال سقوط شوالیه ها Knightfall با زیرنویس فارسی\n\n\n\n\n دانلود فیلم پرتقال خونی\n\n\n\n\n دانلود فیلم Snowpiercer 2013 قطار یخ شکن\n\n\n\n\n دانلود فیلم نقش‎نگار با کیفیت HD\n\n\n\n\n دانلود فیلم عصر یخبندان با کیفیت HD\n\n\n\n\n دانلود فیلم خون بازی با لینک مستقیم\n\n\n\n\n دانلود فیلم یکی از ما دو نفر با لینک مستقیم و کیفیت عالی\n\n\n\n\n دانلود فیلم آدمکش با لینک مستقیم\n\n\n\n\n\n\n\nپربازدید ترین ها\n\n\n\n\n\n دانلود سریال طنز چار دیواری با کیفیت عالی و لینک مستقیم_تک فیلم\n\n\n\n\n دانلود سریال تلویزیونی “پس از باران” با کیفیت عالی\n\n\n\n\n دانلود فیلم رویای خیس با کیفیت عالی و لینک مستقیم\n\n\n\n\n دانلود رایگان سریال مرد هزار چهره با کیفیت عالی HD\n\n\n\n\n دانلود سریال ایرانی خوش نشین ها\n\n\n\n\n دانلود سریال زیبا ی قرارگاه مسکونی\n\n\n\n\n دانلود سریال خط قرمز با لینک مستقیم\n\n\n\n\n دانلود رایگان سریال جایزه بزرگ با کیفیت عالی\n\n\n\n\n دانلود رایگان سریال مرد دو هزار چهره با کیفیت عالی\n\n\n\n\n دانلود فیلم تو و من با کیفیت HD و لینک مستقیم\n\n\n\n\n\n\n\n\n\nدرخواست آهنگ مجاز\nآهنگ مورد نیاز خود را درخواست کنید.\n\n\n\n\nآمار سایت\n\n\n\n \n \n \n \n \n \n \n \n\n\n\n\nفیسبوک\nگوگل پلاس\nیاهو\n\n\n\nتبلیغات متنی\n\n\n\n\n\n\n\n\n\n\n\n\nبرچسب ها tags\n\nسایت آپ تی وی1\nسایت دانلود فیلم\nسایت دانلود فیلم ایرانی\nدانلود فیلم سینمایی جدید\nuptv1.blog.ir\nدانلود فیلم ایرانی جدید\nدانلود فیلم های علی صادقی\nسایت فیلم و سریال\nسایت طنز ایرونی\nدانلود فیلم های محمد رضا گلزار\nدانلود فیلم جدید ایرانی\nدانلود فیلم طنز\nسایت فیلم سریال\nدانلود فیلم های سحر قریشی\nدانلود فیلم های رضا عطاران\nدانلود فیلم ایرانی\nدانلود فیلم های بهرام رادان\nدانلود فیلم های الناز شاکردوست\nدانلود فیلم کمدی\nسایت فیلم وسریال\nدانلود سریال ایرانی\nدانلود فیلم های امین حیایی\nسایت دانلود فیلم خارجی\nدانلود فیلم رایگان\nدانلود فیلم دوبله فارسی\nدانلود فیلم عشقی\nدانلود فیلم های مهران غفوریان\nدانلود فیلم های جواد رضویان\nدانلود سریال های مهران مدیری\nدانلود فیلم با حجم کم\n\n\n\nدرباره سایت تماس با ما\n\nسایت دانلود فیلم و سریال ایرانی                                                                            http:// .uptv1blog.ir\n\n\n\n\n\n\nupdateSearchBoxTheme('srchBx')\n\n\n\n\t\t\t\tدنبال کنندگان\n\t\t\t\t\n\t\t\t\t\t\t۹\n\t\t\t\t\tنفر\n\t\t\t\t\n\n\n\n\n\n\n\n\n\n\n\n\n\n\n\n\n\n\n\n\n\n\n\n\n\n\n\n\n\n\n\n\n\t\t\t\tاین وبلاگ را دنبال کنید\n\t\t\t\n\n\n\n\n\nلینک دوستان ارسال لینک\n\n تبادل لینک رایگان\n ساخت وبلاگ جدید در blog.ir\n دانلود فیلم و سریال\nدانلود آهنگ جدید\n\n\n\nصفحات جداگانه آرشیو\n\n\nدانلود سریال طنز ایرونی\n\n\nدانلود انیمیشن دوبله فارسی\n\n\nنوستالژی\n\n\nدانلود سریال متهم گریخت\n\n\nدانلود فیلم سینمایی خارجی\n\n\nدانلود سریال خط قرمز\n\n\nدانلود فیلم کمدی ایرانی\n\n\nدانلود سریال سه در چهار\n\n\nفیلم و سریال\n\n\n\n\n\n\n\nتمامی حقوق مطالب برای آپ تی وی تک محفوظ است و هرگونه کپی برداری بدون ذکر منبع ممنوع می باشد.\nترجمه قالب توسط هایپرتمپ و قالب بیان صورت گرفته است و هرگونه کپی برداری از قالب پیگرد قانونی خواهد داشت.\n\nصفحه اصلی ،\nنقشه سایت ،\nطراح قالب ،\nمترجم قالب،\nقالب بیان\n\n\n\n\n\nعضویت در کانال تلگرام هکس دانلود (کلیک کنید)", "post_full_content_2": "\n\nدانلود فیلم مالاریا  رایگان\n\n\n\n\n\nدانلود فیلم مالاریا با کیفیت ۱۰۸۰p و لینک مستقیم\n\n\n\n\n\nنام اثر: مالاریا\nکیفیت ها: full hd 1080p – hd 720p – sd 480p – \nمخاطب: بزرگسالان\nنوع فیلم: سینمایی\nمحصول: ایران\nموضوع: اجتماعی\nنویسنده و کارگردان: پرویز شهبازی\nتهیه کنندگان: مسعود ردایی\nبا هنرنمایی:  ساعد سهیلی، ساغر قناعت، آذرخش فراهانی (برادر گلشیفته)، آزاده نامداری، سیامک ادیب، علیرضا استادی و…\nسال تولید: 1394\nتاریخ انتشار: 1396\nمدت زمان: 95 دقیقه\nخلاصه داستان:\nدرباره دختری بنام حنا (ساغر قناعت) و پسری بنام مرتضی (ساعد سهیلی) است که در تهران گردی‌های خود با مردی برخورد می‌کنند که مشکلی دارد. آن‌ها سعی می‌کنند راه حلی برای این مشکل پیدا کنند و…\n\n\n\nمنبع : سایت آپ تی وی تک\n\n\nکیفیت : 1080P ، فرمت : mkv ، حجم فیلم : 582 گیگابایتکیفیت 1080pکیفیت 1080p (سرور دوم)\n\n\nادامه مطلب\n\n\n\nتاریخ : چهارشنبه, ۴ بهمن ۱۳۹۶، ۱۲:۲۶ ب.ظ\n\nموضوع :دسته:\n فیلم ها  ,\n ایرانی  ,\n\nبازدید : ۱۵ بار\nنظرات : ۰\n\n\n\n۰\n\n-\n\n\n۰\n\n\n\n\n\n\n\nدیدگاه کاربران\n\n\n\n\n\n\nدیدگاه ارسال شده توسط شما ، پس از تایید توسط مدیران سایت منتشر خواهد شد.\nدیدگاهی که به غیر از زبان فارسی یا غیر مرتبط با مطلب باشد منتشر نخواهد شد.\n\n\n\nارسال نظر آزاد است، اما اگر قبلا در بیان ثبت نام کرده اید می توانید ابتدا وارد شوید.\n\n\n\nنام *\n\n\n\n\n\n\n\nپست الکترونيک\n\n\n\n\n\n\n\nسایت یا وبلاگ\n\n\n\n\n\n\n\n\nپیام *\n\n\n\nشما میتوانید از این تگهای html استفاده کنید:   b یا strong، em یا i، u، strike یا s، sup، sub،  blockquote، code، pre، hr، br، p، a href=\"\" title=\"\"، span style=\"\"، div align=\"\"\n\n\n\n\n\nکد امنیتی *\n\n\n\n\n\n\nارقام فارسی و انگلیسی پذیرفته می‌شوند\n\n\n\n\n\nنظر بصورت خصوصی ارسال شود\nنظر شما به هیچ وجه امکان عمومی شدن در قسمت نظرات را ندارد، و تنها راه پاسخگویی به آن نیز از طریق پست الکترونیک می‌باشد. بنابراین در صورتیکه مایل به دریافت پاسخ هستید، پست الکترونیک خود را وارد کنید.\n\n\n\n\n\n\nپست الکترونیک برای عموم قابل مشاهده باشد\nاخطار!\n\n\n\n\n\n\n\n\n\n\n\n\n\n\n\nدسته بندی\n\n\n\n\nسریال ایرونی طنز\n\n\nسریال سه در چهار\n\n\n\n\nسریال شبهای برره\n\n\n\n\nسریال ساخت ایران\n\n\n\n\nسریال متهم گریخت\n\n\n\n\nسریال خوش نشین ها\n\n\n\n\n\n\nنوستالژی\n\n\nکارتون پسر شجاع\n\n\n\n\nقصه های تابه تا\n\n\n\n\nکارتون سندباد\n\n\n\n\nفیلم خاطره  انگیزه دزد عروسک ها\n\n\n\n\nکلاه قرمزی94\n\n\n\n\n\n\nفیلم ها\n\n\nایرانی\n\n\n\n\nخارجی\n\n\n\n\n\n\nسریال ها\n\n\nسریال ایرانی\n\n\n\n\nسریال خارجی\n\n\n\n\n\n\nانیمیشن\n\n\n\n\n\n\n\n\nآرشیو\n\n\n\nبهمن ۱۳۹۶\nدی ۱۳۹۶\nآذر ۱۳۹۶\nآبان ۱۳۹۶\n\n\n\n\n\nنویسندگان\n\n\n\n\n\nپژمان حیدری\n\n\n\n\n\n\n\nآخرین مطالب\n\n\n\n\n\n دانلود انیمیشن دراکولای کوچک The Little Vampire 2018 با دوبله فارسی و کیفیت عالی\n\n\n\n\n دانلود فیلم مالاریا  رایگان\n\n\n\n\n دانلود سریال سقوط شوالیه ها Knightfall با زیرنویس فارسی\n\n\n\n\n دانلود فیلم پرتقال خونی\n\n\n\n\n دانلود فیلم Snowpiercer 2013 قطار یخ شکن\n\n\n\n\n دانلود فیلم نقش‎نگار با کیفیت HD\n\n\n\n\n دانلود فیلم عصر یخبندان با کیفیت HD\n\n\n\n\n دانلود فیلم خون بازی با لینک مستقیم\n\n\n\n\n دانلود فیلم یکی از ما دو نفر با لینک مستقیم و کیفیت عالی\n\n\n\n\n دانلود فیلم آدمکش با لینک مستقیم\n\n\n\n\n\n\n\nپربازدید ترین ها\n\n\n\n\n\n دانلود سریال طنز چار دیواری با کیفیت عالی و لینک مستقیم_تک فیلم\n\n\n\n\n دانلود سریال تلویزیونی “پس از باران” با کیفیت عالی\n\n\n\n\n دانلود فیلم رویای خیس با کیفیت عالی و لینک مستقیم\n\n\n\n\n دانلود رایگان سریال مرد هزار چهره با کیفیت عالی HD\n\n\n\n\n دانلود سریال ایرانی خوش نشین ها\n\n\n\n\n دانلود سریال زیبا ی قرارگاه مسکونی\n\n\n\n\n دانلود سریال خط قرمز با لینک مستقیم\n\n\n\n\n دانلود رایگان سریال جایزه بزرگ با کیفیت عالی\n\n\n\n\n دانلود رایگان سریال مرد دو هزار چهره با کیفیت عالی\n\n\n\n\n دانلود فیلم تو و من با کیفیت HD و لینک مستقیم\n\n\n\n\n\n\n\n\n\nدرخواست آهنگ مجاز\nآهنگ مورد نیاز خود را درخواست کنید.\n\n\n\n\nآمار سایت\n\n\n\n \n \n \n \n \n \n \n \n\n\n\n\nفیسبوک\nگوگل پلاس\nیاهو\n\n\n\nتبلیغات متنی\n\n\n\n\n\n\n\n\n\n\n\n\nبرچسب ها tags\n\nسایت آپ تی وی1\nسایت دانلود فیلم\nسایت دانلود فیلم ایرانی\nدانلود فیلم سینمایی جدید\nuptv1.blog.ir\nدانلود فیلم ایرانی جدید\nدانلود فیلم های علی صادقی\nسایت فیلم و سریال\nسایت طنز ایرونی\nدانلود فیلم های محمد رضا گلزار\nدانلود فیلم جدید ایرانی\nدانلود فیلم طنز\nسایت فیلم سریال\nدانلود فیلم های سحر قریشی\nدانلود فیلم های رضا عطاران\nدانلود فیلم ایرانی\nدانلود فیلم های بهرام رادان\nدانلود فیلم های الناز شاکردوست\nدانلود فیلم کمدی\nسایت فیلم وسریال\nدانلود سریال ایرانی\nدانلود فیلم های امین حیایی\nسایت دانلود فیلم خارجی\nدانلود فیلم رایگان\nدانلود فیلم دوبله فارسی\nدانلود فیلم عشقی\nدانلود فیلم های مهران غفوریان\nدانلود فیلم های جواد رضویان\nدانلود سریال های مهران مدیری\nدانلود فیلم با حجم کم\n\n\n\nدرباره سایت تماس با ما\n\nسایت دانلود فیلم و سریال ایرانی                                                                            http:// .uptv1blog.ir\n\n\n\n\n\n\nupdateSearchBoxTheme('srchBx')\n\n\n\n\t\t\t\tدنبال کنندگان\n\t\t\t\t\n\t\t\t\t\t\t۹\n\t\t\t\t\tنفر\n\t\t\t\t\n\n\n\n\n\n\n\n\n\n\n\n\n\n\n\n\n\n\n\n\n\n\n\n\n\n\n\n\n\n\n\n\n\t\t\t\tاین وبلاگ را دنبال کنید\n\t\t\t\n\n\n\n\n\nلینک دوستان ارسال لینک\n\n تبادل لینک رایگان\n ساخت وبلاگ جدید در blog.ir\n دانلود فیلم و سریال\nدانلود آهنگ جدید\n\n\n\nصفحات جداگانه آرشیو\n\n\nدانلود سریال طنز ایرونی\n\n\nدانلود انیمیشن دوبله فارسی\n\n\nنوستالژی\n\n\nدانلود سریال متهم گریخت\n\n\nدانلود فیلم سینمایی خارجی\n\n\nدانلود سریال خط قرمز\n\n\nدانلود فیلم کمدی ایرانی\n\n\nدانلود سریال سه در چهار\n\n\nفیلم و سریال\n\n\n\n\n\n\n\nتمامی حقوق مطالب برای آپ تی وی تک محفوظ است و هرگونه کپی برداری بدون ذکر منبع ممنوع می باشد.\nترجمه قالب توسط هایپرتمپ و قالب بیان صورت گرفته است و هرگونه کپی برداری از قالب پیگرد قانونی خواهد داشت.\n\nصفحه اصلی ،\nنقشه سایت ،\nطراح قالب ،\nمترجم قالب،\nقالب بیان\n\n\n\n\n\nعضویت در کانال تلگرام هکس دانلود (کلیک کنید)", "post_full_content_3": "\n\nدانلود سریال سقوط شوالیه ها Knightfall با زیرنویس فارسی\n\n\n\n\nدانلود سریال سقوط شوالیه ها Knightfall با زیرنویس فارسی\nکیفیت HD 720p ، HD 1080p – سانسور شده\n\nدانلود سریال سقوط شوالیه ها Knightfall\nاین سریال زیرنویس فارسی و سانسور شده و هیچ گونه صحنه غیر اخلاقی و مغایر با شئونات اسلامی ندارد.\nنام اثر: سریال سقوط شوالیه ها Knightfall\nکیفیت: HD 720p ، HD 1080p – \nامتیاز: IMDb 6.3/10\nمخاطب:  تماشای این فیلم به افراد زیر 13 سال توصیه نمی شود.\nمحصول: آمریکا دانلود سریال سقوط شوالیه ها\nموضوع: تاریخی | درام | اکشن | ماجراجوی\nکارگردان: Douglas Mackinnon\nستارگان : Tom Cullen , Jim Carter , Pádraic Delaney , Simon Merrells , Julian Ovenden , Olivia Ross ,Ed Stoppard ,Sabrina Bartlett ,Bobby Schofield ,Sarah Sofie Boussnina\nزبان: انگلیسی (زیرنویس)\nمدت زمان: هر قسمت میانگین 50 دقیقه\nسال تولید: 2017 – ادامه دارد\nتاریخ انتشار: 2017 – ادامه دارد\nداستان سریال:\nپس از اینکه شوالیه های تمپلار که سال ها در راس قدرت بودند با شکست آخرین سنگرشان، ایکر، از صحنه کنار رفتند شایعه شد که جام مقدس در همان مکان گم شده و گروهی برای بدست آوردندش به آنجا باز میگردند…\n\n\n\n \n\n\nلینک های دانلود سریالمنبع : سایت آپ تی وی\n\n\nفصل : اولکیفیت : 720p - 1080pمشاهده لینک ها\n\nقسمت : 01زبان : زیرنویس فارسیدانلود با کیفیت 1080pدانلود با کیفیت 1080p (سرور دوم)دانلود با کیفیت 720Pدانلود با کیفیت 720P (سرور دوم)\n\n\nقسمت : 02زبان : زیرنویس فارسیدانلود با کیفیت 1080pدانلود با کیفیت 1080p (سرور دوم)دانلود با کیفیت 720pدانلود با کیفیت 720P (سرور دوم)\n\n\nقسمت : 03دانلود با کیفیت 1080pدانلود با کیفیت 1080p (سرور دوم)دانلود با کیفیت 720pدانلود با کیفیت 720p (سرور دوم)\n\n\nقسمت : 04دانلود با کیفیت 1080pدانلود با کیفیت 1080p (سرور دوم)دانلود با کیفیت 720pدانلود با کیفیت 720p (سرور دوم)\n\n\n\n\n\nادامه مطلب\n\n\n\nتاریخ : دوشنبه, ۲ بهمن ۱۳۹۶، ۰۳:۰۵ ب.ظ\n\nموضوع :دسته:\n سریال خارجی  ,\n\nبازدید : ۱۷ بار\nنظرات : ۰\n\n\n\n۰\n\n-\n\n\n۰\n\n\n\n\n\n\n\nدیدگاه کاربران\n\n\n\n\n\n\nدیدگاه ارسال شده توسط شما ، پس از تایید توسط مدیران سایت منتشر خواهد شد.\nدیدگاهی که به غیر از زبان فارسی یا غیر مرتبط با مطلب باشد منتشر نخواهد شد.\n\n\n\nارسال نظر آزاد است، اما اگر قبلا در بیان ثبت نام کرده اید می توانید ابتدا وارد شوید.\n\n\n\nنام *\n\n\n\n\n\n\n\nپست الکترونيک\n\n\n\n\n\n\n\nسایت یا وبلاگ\n\n\n\n\n\n\n\n\nپیام *\n\n\n\nشما میتوانید از این تگهای html استفاده کنید:   b یا strong، em یا i، u، strike یا s، sup، sub،  blockquote، code، pre، hr، br، p، a href=\"\" title=\"\"، span style=\"\"، div align=\"\"\n\n\n\n\n\nکد امنیتی *\n\n\n\n\n\n\nارقام فارسی و انگلیسی پذیرفته می‌شوند\n\n\n\n\n\nنظر بصورت خصوصی ارسال شود\nنظر شما به هیچ وجه امکان عمومی شدن در قسمت نظرات را ندارد، و تنها راه پاسخگویی به آن نیز از طریق پست الکترونیک می‌باشد. بنابراین در صورتیکه مایل به دریافت پاسخ هستید، پست الکترونیک خود را وارد کنید.\n\n\n\n\n\n\nپست الکترونیک برای عموم قابل مشاهده باشد\nاخطار!\n\n\n\n\n\n\n\n\n\n\n\n\n\n\n\nدسته بندی\n\n\n\n\nسریال ایرونی طنز\n\n\nسریال سه در چهار\n\n\n\n\nسریال شبهای برره\n\n\n\n\nسریال ساخت ایران\n\n\n\n\nسریال متهم گریخت\n\n\n\n\nسریال خوش نشین ها\n\n\n\n\n\n\nنوستالژی\n\n\nکارتون پسر شجاع\n\n\n\n\nقصه های تابه تا\n\n\n\n\nکارتون سندباد\n\n\n\n\nفیلم خاطره  انگیزه دزد عروسک ها\n\n\n\n\nکلاه قرمزی94\n\n\n\n\n\n\nفیلم ها\n\n\nایرانی\n\n\n\n\nخارجی\n\n\n\n\n\n\nسریال ها\n\n\nسریال ایرانی\n\n\n\n\nسریال خارجی\n\n\n\n\n\n\nانیمیشن\n\n\n\n\n\n\n\n\nآرشیو\n\n\n\nبهمن ۱۳۹۶\nدی ۱۳۹۶\nآذر ۱۳۹۶\nآبان ۱۳۹۶\n\n\n\n\n\nنویسندگان\n\n\n\n\n\nپژمان حیدری\n\n\n\n\n\n\n\nآخرین مطالب\n\n\n\n\n\n دانلود انیمیشن دراکولای کوچک The Little Vampire 2018 با دوبله فارسی و کیفیت عالی\n\n\n\n\n دانلود فیلم مالاریا  رایگان\n\n\n\n\n دانلود سریال سقوط شوالیه ها Knightfall با زیرنویس فارسی\n\n\n\n\n دانلود فیلم پرتقال خونی\n\n\n\n\n دانلود فیلم Snowpiercer 2013 قطار یخ شکن\n\n\n\n\n دانلود فیلم نقش‎نگار با کیفیت HD\n\n\n\n\n دانلود فیلم عصر یخبندان با کیفیت HD\n\n\n\n\n دانلود فیلم خون بازی با لینک مستقیم\n\n\n\n\n دانلود فیلم یکی از ما دو نفر با لینک مستقیم و کیفیت عالی\n\n\n\n\n دانلود فیلم آدمکش با لینک مستقیم\n\n\n\n\n\n\n\nپربازدید ترین ها\n\n\n\n\n\n دانلود سریال طنز چار دیواری با کیفیت عالی و لینک مستقیم_تک فیلم\n\n\n\n\n دانلود سریال تلویزیونی “پس از باران” با کیفیت عالی\n\n\n\n\n دانلود فیلم رویای خیس با کیفیت عالی و لینک مستقیم\n\n\n\n\n دانلود رایگان سریال مرد هزار چهره با کیفیت عالی HD\n\n\n\n\n دانلود سریال ایرانی خوش نشین ها\n\n\n\n\n دانلود سریال زیبا ی قرارگاه مسکونی\n\n\n\n\n دانلود سریال خط قرمز با لینک مستقیم\n\n\n\n\n دانلود رایگان سریال جایزه بزرگ با کیفیت عالی\n\n\n\n\n دانلود رایگان سریال مرد دو هزار چهره با کیفیت عالی\n\n\n\n\n دانلود فیلم تو و من با کیفیت HD و لینک مستقیم\n\n\n\n\n\n\n\n\n\nدرخواست آهنگ مجاز\nآهنگ مورد نیاز خود را درخواست کنید.\n\n\n\n\nآمار سایت\n\n\n\n \n \n \n \n \n \n \n \n\n\n\n\nفیسبوک\nگوگل پلاس\nیاهو\n\n\n\nتبلیغات متنی\n\n\n\n\n\n\n\n\n\n\n\n\nبرچسب ها tags\n\nسایت آپ تی وی1\nسایت دانلود فیلم\nسایت دانلود فیلم ایرانی\nدانلود فیلم سینمایی جدید\nuptv1.blog.ir\nدانلود فیلم ایرانی جدید\nدانلود فیلم های علی صادقی\nسایت فیلم و سریال\nسایت طنز ایرونی\nدانلود فیلم های محمد رضا گلزار\nدانلود فیلم جدید ایرانی\nدانلود فیلم طنز\nسایت فیلم سریال\nدانلود فیلم های سحر قریشی\nدانلود فیلم های رضا عطاران\nدانلود فیلم ایرانی\nدانلود فیلم های بهرام رادان\nدانلود فیلم های الناز شاکردوست\nدانلود فیلم کمدی\nسایت فیلم وسریال\nدانلود سریال ایرانی\nدانلود فیلم های امین حیایی\nسایت دانلود فیلم خارجی\nدانلود فیلم رایگان\nدانلود فیلم دوبله فارسی\nدانلود فیلم عشقی\nدانلود فیلم های مهران غفوریان\nدانلود فیلم های جواد رضویان\nدانلود سریال های مهران مدیری\nدانلود فیلم با حجم کم\n\n\n\nدرباره سایت تماس با ما\n\nسایت دانلود فیلم و سریال ایرانی                                                                            http:// .uptv1blog.ir\n\n\n\n\n\n\nupdateSearchBoxTheme('srchBx')\n\n\n\n\t\t\t\tدنبال کنندگان\n\t\t\t\t\n\t\t\t\t\t\t۹\n\t\t\t\t\tنفر\n\t\t\t\t\n\n\n\n\n\n\n\n\n\n\n\n\n\n\n\n\n\n\n\n\n\n\n\n\n\n\n\n\n\n\n\n\n\t\t\t\tاین وبلاگ را دنبال کنید\n\t\t\t\n\n\n\n\n\nلینک دوستان ارسال لینک\n\n تبادل لینک رایگان\n ساخت وبلاگ جدید در blog.ir\n دانلود فیلم و سریال\nدانلود آهنگ جدید\n\n\n\nصفحات جداگانه آرشیو\n\n\nدانلود سریال طنز ایرونی\n\n\nدانلود انیمیشن دوبله فارسی\n\n\nنوستالژی\n\n\nدانلود سریال متهم گریخت\n\n\nدانلود فیلم سینمایی خارجی\n\n\nدانلود سریال خط قرمز\n\n\nدانلود فیلم کمدی ایرانی\n\n\nدانلود سریال سه در چهار\n\n\nفیلم و سریال\n\n\n\n\n\n\n\nتمامی حقوق مطالب برای آپ تی وی تک محفوظ است و هرگونه کپی برداری بدون ذکر منبع ممنوع می باشد.\nترجمه قالب توسط هایپرتمپ و قالب بیان صورت گرفته است و هرگونه کپی برداری از قالب پیگرد قانونی خواهد داشت.\n\nصفحه اصلی ،\nنقشه سایت ،\nطراح قالب ،\nمترجم قالب،\nقالب بیان\n\n\n\n\n\nعضویت در کانال تلگرام هکس دانلود (کلیک کنید)", "post_full_content_1": "\n\nدانلود انیمیشن دراکولای کوچک The Little Vampire 2018 با دوبله فارسی و کیفیت عالی\n\n\n\n\n\nدانلود انیمیشن دراکولای کوچک The Little Vampire 2018 با دوبله فارسی و کیفیت عالی\n\n\n\nنام اثر: دراکولای کوچک The Little Vampire 2017\nکیفیت: DVDRip – \nژانر: انیمیشن\nمخاطب:  همه گروه های سنی\nمحصول: کشور آمریکا\nزبان: فارسی (دوبله)\nسال تولید: 2015\nمدت زمان: 92 دقیقه\nداستان انیمیشن :رودولف ، خون آشام 13 ساله که قبیله اش توسط یک شکارچی خون آشام بد نام تهدید می شود با تونی ملاقات می کند و …\n\n\n \n\n\n\nلینک های دانلود با دوبله فارسیمنبع : سایت آپ تی وی تک\n\n\nکیفیت 720p ، فرمت : mkv ، حجم : 635 مگابایتکیفیت 720pکیفیت 720p (سرور دوم)\n\n\n\nادامه مطلب\n\n\n\nتاریخ : پنجشنبه, ۵ بهمن ۱۳۹۶، ۱۲:۱۴ ب.ظ\n\nموضوع :دسته:\n انیمیشن  ,\n\nبازدید : ۹ بار\nنظرات : ۰\n\n\n\n۰\n\n-\n\n\n۰\n\n\n\n\n\n\n\nدیدگاه کاربران\n\n\n\n\n\n\nدیدگاه ارسال شده توسط شما ، پس از تایید توسط مدیران سایت منتشر خواهد شد.\nدیدگاهی که به غیر از زبان فارسی یا غیر مرتبط با مطلب باشد منتشر نخواهد شد.\n\n\n\nارسال نظر آزاد است، اما اگر قبلا در بیان ثبت نام کرده اید می توانید ابتدا وارد شوید.\n\n\n\nنام *\n\n\n\n\n\n\n\nپست الکترونيک\n\n\n\n\n\n\n\nسایت یا وبلاگ\n\n\n\n\n\n\n\n\nپیام *\n\n\n\nشما میتوانید از این تگهای html استفاده کنید:   b یا strong، em یا i، u، strike یا s، sup، sub،  blockquote، code، pre، hr، br، p، a href=\"\" title=\"\"، span style=\"\"، div align=\"\"\n\n\n\n\n\nکد امنیتی *\n\n\n\n\n\n\nارقام فارسی و انگلیسی پذیرفته می‌شوند\n\n\n\n\n\nنظر بصورت خصوصی ارسال شود\nنظر شما به هیچ وجه امکان عمومی شدن در قسمت نظرات را ندارد، و تنها راه پاسخگویی به آن نیز از طریق پست الکترونیک می‌باشد. بنابراین در صورتیکه مایل به دریافت پاسخ هستید، پست الکترونیک خود را وارد کنید.\n\n\n\n\n\n\nپست الکترونیک برای عموم قابل مشاهده باشد\nاخطار!\n\n\n\n\n\n\n\n\n\n\n\n\n\n\n\nدسته بندی\n\n\n\n\nسریال ایرونی طنز\n\n\nسریال سه در چهار\n\n\n\n\nسریال شبهای برره\n\n\n\n\nسریال ساخت ایران\n\n\n\n\nسریال متهم گریخت\n\n\n\n\nسریال خوش نشین ها\n\n\n\n\n\n\nنوستالژی\n\n\nکارتون پسر شجاع\n\n\n\n\nقصه های تابه تا\n\n\n\n\nکارتون سندباد\n\n\n\n\nفیلم خاطره  انگیزه دزد عروسک ها\n\n\n\n\nکلاه قرمزی94\n\n\n\n\n\n\nفیلم ها\n\n\nایرانی\n\n\n\n\nخارجی\n\n\n\n\n\n\nسریال ها\n\n\nسریال ایرانی\n\n\n\n\nسریال خارجی\n\n\n\n\n\n\nانیمیشن\n\n\n\n\n\n\n\n\nآرشیو\n\n\n\nبهمن ۱۳۹۶\nدی ۱۳۹۶\nآذر ۱۳۹۶\nآبان ۱۳۹۶\n\n\n\n\n\nنویسندگان\n\n\n\n\n\nپژمان حیدری\n\n\n\n\n\n\n\nآخرین مطالب\n\n\n\n\n\n دانلود انیمیشن دراکولای کوچک The Little Vampire 2018 با دوبله فارسی و کیفیت عالی\n\n\n\n\n دانلود فیلم مالاریا  رایگان\n\n\n\n\n دانلود سریال سقوط شوالیه ها Knightfall با زیرنویس فارسی\n\n\n\n\n دانلود فیلم پرتقال خونی\n\n\n\n\n دانلود فیلم Snowpiercer 2013 قطار یخ شکن\n\n\n\n\n دانلود فیلم نقش‎نگار با کیفیت HD\n\n\n\n\n دانلود فیلم عصر یخبندان با کیفیت HD\n\n\n\n\n دانلود فیلم خون بازی با لینک مستقیم\n\n\n\n\n دانلود فیلم یکی از ما دو نفر با لینک مستقیم و کیفیت عالی\n\n\n\n\n دانلود فیلم آدمکش با لینک مستقیم\n\n\n\n\n\n\n\nپربازدید ترین ها\n\n\n\n\n\n دانلود سریال طنز چار دیواری با کیفیت عالی و لینک مستقیم_تک فیلم\n\n\n\n\n دانلود سریال تلویزیونی “پس از باران” با کیفیت عالی\n\n\n\n\n دانلود فیلم رویای خیس با کیفیت عالی و لینک مستقیم\n\n\n\n\n دانلود رایگان سریال مرد هزار چهره با کیفیت عالی HD\n\n\n\n\n دانلود سریال ایرانی خوش نشین ها\n\n\n\n\n دانلود سریال زیبا ی قرارگاه مسکونی\n\n\n\n\n دانلود سریال خط قرمز با لینک مستقیم\n\n\n\n\n دانلود رایگان سریال جایزه بزرگ با کیفیت عالی\n\n\n\n\n دانلود رایگان سریال مرد دو هزار چهره با کیفیت عالی\n\n\n\n\n دانلود فیلم تو و من با کیفیت HD و لینک مستقیم\n\n\n\n\n\n\n\n\n\nدرخواست آهنگ مجاز\nآهنگ مورد نیاز خود را درخواست کنید.\n\n\n\n\nآمار سایت\n\n\n\n \n \n \n \n \n \n \n \n\n\n\n\nفیسبوک\nگوگل پلاس\nیاهو\n\n\n\nتبلیغات متنی\n\n\n\n\n\n\n\n\n\n\n\n\nبرچسب ها tags\n\nسایت آپ تی وی1\nسایت دانلود فیلم\nسایت دانلود فیلم ایرانی\nدانلود فیلم سینمایی جدید\nuptv1.blog.ir\nدانلود فیلم ایرانی جدید\nدانلود فیلم های علی صادقی\nسایت فیلم و سریال\nسایت طنز ایرونی\nدانلود فیلم های محمد رضا گلزار\nدانلود فیلم جدید ایرانی\nدانلود فیلم طنز\nسایت فیلم سریال\nدانلود فیلم های سحر قریشی\nدانلود فیلم های رضا عطاران\nدانلود فیلم ایرانی\nدانلود فیلم های بهرام رادان\nدانلود فیلم های الناز شاکردوست\nدانلود فیلم کمدی\nسایت فیلم وسریال\nدانلود سریال ایرانی\nدانلود فیلم های امین حیایی\nسایت دانلود فیلم خارجی\nدانلود فیلم رایگان\nدانلود فیلم دوبله فارسی\nدانلود فیلم عشقی\nدانلود فیلم های مهران غفوریان\nدانلود فیلم های جواد رضویان\nدانلود سریال های مهران مدیری\nدانلود فیلم با حجم کم\n\n\n\nدرباره سایت تماس با ما\n\nسایت دانلود فیلم و سریال ایرانی                                                                            http:// .uptv1blog.ir\n\n\n\n\n\n\nupdateSearchBoxTheme('srchBx')\n\n\n\n\t\t\t\tدنبال کنندگان\n\t\t\t\t\n\t\t\t\t\t\t۹\n\t\t\t\t\tنفر\n\t\t\t\t\n\n\n\n\n\n\n\n\n\n\n\n\n\n\n\n\n\n\n\n\n\n\n\n\n\n\n\n\n\n\n\n\n\t\t\t\tاین وبلاگ را دنبال کنید\n\t\t\t\n\n\n\n\n\nلینک دوستان ارسال لینک\n\n تبادل لینک رایگان\n ساخت وبلاگ جدید در blog.ir\n دانلود فیلم و سریال\nدانلود آهنگ جدید\n\n\n\nصفحات جداگانه آرشیو\n\n\nدانلود سریال طنز ایرونی\n\n\nدانلود انیمیشن دوبله فارسی\n\n\nنوستالژی\n\n\nدانلود سریال متهم گریخت\n\n\nدانلود فیلم سینمایی خارجی\n\n\nدانلود سریال خط قرمز\n\n\nدانلود فیلم کمدی ایرانی\n\n\nدانلود سریال سه در چهار\n\n\nفیلم و سریال\n\n\n\n\n\n\n\nتمامی حقوق مطالب برای آپ تی وی تک محفوظ است و هرگونه کپی برداری بدون ذکر منبع ممنوع می باشد.\nترجمه قالب توسط هایپرتمپ و قالب بیان صورت گرفته است و هرگونه کپی برداری از قالب پیگرد قانونی خواهد داشت.\n\nصفحه اصلی ،\nنقشه سایت ،\nطراح قالب ،\nمترجم قالب،\nقالب بیان\n\n\n\n\n\nعضویت در کانال تلگرام هکس دانلود (کلیک کنید)"}