{"type": "blog", "blog_name": "آسمان دانلود", "blog_url": "http://asemandanlod.blog.ir/", "post_url_1": "http://asemandanlod.blog.ir/post/%D8%AF%D8%A7%D9%86%D9%84%D9%88%D8%AF%20Age%20of%20Empires%3A%20Castle%20Siege%201.23.199%20%D8%A8%D8%A7%D8%B2%DB%8C%20%D8%A7%D8%B3%D8%AA%D8%B1%D8%A7%D8%AA%DA%98%DB%8C%20%D8%AE%D8%A7%D8%B1%D9%82%20%D8%A7%D9%84%D8%B9%D8%A7%D8%AF%D9%87%20%E2%80%9C%D8%B9%D8%B5%D8%B1%20%D9%81%D8%B1%D9%85%D8%A7%D9%86%D8%B1%D9%88%D8%A7%DB%8C%D8%A7%D9%86%20%2B%20%D8%AF%DB%8C%D8%AA%D8%A7", "post_title_1": "دانلود Age of Empires: Castle Siege 1.23.199 بازی استراتژی خارق العاده “عصر فرمانروایان + دیتا", "post_content_1": "\nبه فارسی “عصر فرمانروایان: محاصره قلعه” بازی جدید و خارق العاده در سبک بازیهای استراتژی از کمپانی محبوب Microsoft Corporation برای اندروید است که چند دقیقه پیش به صورت رایگان در مارکت بزرگ گوگل منتشر شد و باز هم مثل همیشه تصمیم گرفتیم برای اولین بار در ایران\n ان را حضور شما دوستداران بازیهای استراتژی اندروید معرفی کنیم و برای بار\n دیگر شما را به وجد بیاوریم! در این بازی شما قادر هستید متناسب با میل \nخود یکی از امپراطوری های بریتانیا، بیزانس(روم شرقی)، فرانسوی ها، روس ها،\n اعراب و یا آلمان تئوتونیک را برگزینید و شروع به ساخت سرزمین اختصاصی خود\n نمایید و سپس با ساخت و آموزش سربازانی سلحشور به نبرد با کاربران آنلاین \nسراسر جهان بپردازید و ساعت ها مشعول شوید! سبک بازی همانند بازی محبوب Clash Of Clans\n هست که در آن شما باید با ایجاد و ساخت امپراطوری قدرتمند مانع از نفوذ \nدشمنان شوید و از طرف دیگر با آموزش نیروهایی قدرتمند به نبرد با کاربران \nآنلاین سراسر جهان بپردازید و با به سرقت بردن منابع، قدرت خود را افزایش \nدهید! بازی Age of Empires: Castle Siege دارای گرافیک خیره کننده اچ دی، \nصداگذاری فوق العاده، کنترلرهای عالی، ساخت بی نظیر و گیم پلی اعتیاداوری \nاست که ان را به همه علاقه مندان به بازیهای استراتژی پیشنهاد می دهیم!\n\n \nادامه مطلب", "post_url_2": "http://asemandanlod.blog.ir/post/%D8%AC%D8%AF%DB%8C%D8%AF%20%D8%AF%D8%A7%D9%86%D9%84%D9%88%D8%AF%20Duet%20Premium%20Edition%203.8%20%E2%80%93%20%D8%A8%D8%A7%D8%B2%DB%8C%20%D8%A2%D8%B1%DA%A9%DB%8C%D8%AF%20%D8%A7%D8%B9%D8%AA%DB%8C%D8%A7%D8%AF%D8%A2%D9%88%D8%B1%20%E2%80%9C%D8%AF%D9%88%D8%A6%D8%AA%E2%80%9D%20%D8%A7%D9%86%D8%AF%D8%B1%D9%88%DB%8C%D8%AF%20%2B%20%D8%A7%D9%88%D8%B1%D8%AC%DB%8C%D9%86%D8%A7%D9%84", "post_title_2": "جدید دانلود Duet Premium Edition 3.8 – بازی آرکید اعتیادآور “دوئت” اندروید + اورجینال", "post_content_2": "\nبازی محبوب و فوق العاده زیبا با گیم پلی اعتیاداور و صداگذاری دلربا از استودیوی بازی سازی Kumobius برای دستگاه های اندروید\n است که به صورت رایگان در گوگل پلی عرضه شده و تا به این لحظه بیش از \nپانصد میلیون بار توسط کاربران اندرویدی سراسر جهان دریافت شده و از \nپردانلودترین ها به شمار می رود و امروز در فارسروید قصد معرفی نسخه اصلی و\n پرمیوم ان را حضور شما کاربران عزیز و همیشگی داریم! در بازی Duet شما \nچرخش دو توپ رنگی یکی قرمز و دیگری آبی را برعهده می گیرید، با لمس سمت \nراست صفحه توپ ها در جهت ساعت گرد و با لمس نیمه سمت چپ توپ ها در جهت \nپادساعت‌گرد شروع به چرخش می کنند و هدف بازی این است که شما به سلامت از \nمیان موانع گذشته و به پایان مسیر برسید! در راه موانع ثابت و متحرک زیادی \nرا در پیش رو دارید و می بایست با دقت هرچه تمام تر طوری توپ ها را \nبچرخانید که بدون برخورد به موانع از لا به لای آنها عبور کنند ؛ چرا که \nاگر با آن ها برخورد کنید توپ ترکیده و مانند یک گلوگه پینت بال مانع را \nرنگ آمیزی می کند! به طور کلی Duet بسیار ساده طراحی شده و تا حد امکان سعی\n شده از زرق و برق های گرافیکی در آن دوری شود ؛ به جای جلوه های بصری سعی \nشده تا به شیوه بازی، نحوه بازی با ذهن کاربر و نوشته هایی که بر روی صفحه \nبرای بازی با اعصاب شما نمایان می‌شود تمرکز گردد!\n\n\nادامه مطلب", "post_url_3": "http://asemandanlod.blog.ir/post/%D8%A2%D9%BE%D8%AF%DB%8C%D8%AA%20%D8%AF%D8%A7%D9%86%D9%84%D9%88%D8%AF%20Darkness%20and%20Flame%20Full%201.0.8%20%E2%80%93%20%D8%A8%D8%A7%D8%B2%DB%8C%20%D9%81%DA%A9%D8%B1%DB%8C%20%D8%B9%D8%A7%D9%84%DB%8C%20%E2%80%9C%D8%B2%D8%A7%D8%AF%D9%87%20%D8%A2%D8%AA%D8%B4%E2%80%9D%20%D8%A7%D9%86%D8%AF%D8%B1%D9%88%DB%8C%D8%AF%20%2B%20%D8%AF%DB%8C%D8%AA%D8%A7", "post_title_3": "آپدیت دانلود Darkness and Flame Full 1.0.8 – بازی فکری عالی “زاده آتش” اندروید + دیتا", "post_content_3": "\nبازی جدید و فوق العاده زیبا تحت عنوان “تاریکی و شعله: زاده آتش” از FIVE-BN GAMES برای اندروید است که ساعت ها پیش با قیمت 2.99 دلار در\n پلی استور عرضه شد و مثل همیشه تصمیم بر این شد تا در اسرع وقت و برای \nاولین بار در ایران نسخه پولی و خریداری شده ان را حضور شما دوستداران بازی\n های فکری و ماجراجویی معرفی کنیم! داستان بازی را اینگونه از زبان سازنده \nبیان می کنیم: “آلیس فقط یک دختر معمولی بود تا زمان یکه او تخم مرغی را در\n یک قفسه عجیب و غریب پیدا کرد و بعد از آن زندگی اش دچار حوادث و اتفاقات \nمرموزی گردید که باعث شد او خانه اش را ترک کند و ماجراجویی پر فراز و \nنشیبی را پشت سر بگذارد! آیا شما می توانید شجاعت او را بازگردانید تا بر \nسرنوشت فعلی اش غلبه کند!؟ ” در این بازی شما به عنوان یک بازیکن باید صدها\n پازل و مینی گیم مختلف را پشت سر بگذارید و با پیدا کردن هزاران شیء مخفی \nداستان بازی را پشت سر بگذارید و ساعت ها خود را سرگرم سازید! اگر از علاقه\n مندان به بازی های شیء مخفی و پازلی اندروید باشید بدون شک Darkness and Flame نظر شما را جل خواهد کرد.\n\nادامه مطلب", "post_url_4": "http://asemandanlod.blog.ir/post/%D8%A2%D9%BE%D8%AF%DB%8C%D8%AA%20%D8%AF%D8%A7%D9%86%D9%84%D9%88%D8%AF%20NBA%20LIVE%20Mobile%20Basketball%201.5.2%20%E2%80%93%20%D8%A8%D8%A7%D8%B2%DB%8C%20%D8%A8%D8%B3%DA%A9%D8%AA%D8%A8%D8%A7%D9%84%20NBA%20%D8%A7%D9%86%D8%AF%D8%B1%D9%88%DB%8C%D8%AF%20!", "post_title_4": "آپدیت دانلود NBA LIVE Mobile Basketball 1.5.2 – بازی بسکتبال NBA اندروید !", "post_content_4": "\n از محبوب ترین و پردانلودترین بازیهای ورزشی بسکتبال از استودیوی مطرح ELECTRONIC ARTS برای اندروید\n است که به صورت رایگان در پلی استور عرضه شده و تا به این لحظه بیش از 50 \nمیلیون بار توسط کاربران اندرویدی سراسر جهان دانلود شده است! بر خلاف \nبازیهای بسکتبال دیگر از جمله NBA 2K 2016 در NBA LIVE Mobile Basketball \nمی بایست با بازیکن های آماتور تیم بسازید و تیم و بازیکن ها را به تدریج و\n با دریافت امتیاز قوی تر کنید! سه حالت مختلف در این بازی دیده می شود، \nیکی اینکه تیم خود را در لیگ چهاره تیمی شرکت می دهید و به مسایقات پلی آف \nمی فرستید تا قهرمان شوید، در واقع همان حالت سنتی بازی های NBA ؛ حالت دوم\n بازی Live Events نام دارد که در آن روزانه چالش هایی برای شما تعریف می \nشود که مهارت بازیتان را بالا می برد و در سومین حالت بازی، یعنی \nhead-to-head، شما کنترل یک بازیکن را در طول یک کواتر بر عهده می گیرید و \nبه صورت آنلاین با یکی که او هم کنترل یک بازیکن را بر عهده دارد بازی می \nکنید! به طور کلی نباید انتظار داشته باشید نسخه موبایل این بازی گرافیک و \nکنترل کنسول های بازی را داشته باشد ؛ گرافیک بازی خوب است، ولی چهره \nبازیکن ها را از نزدیک نمی بینیم ؛ کنترل بازی هم ساده تر است که به همین \nدلیل نسخه موبایل نسخه جذاب تری از آب درآمده است! اگر از علاقه مندان به \nبازیهای بسکتبال اندروید هستید بازی فوق انتخاب مناسبی است!\n\nادامه مطلب", "post_url_5": "http://asemandanlod.blog.ir/post/%D8%A2%D9%BE%D8%AF%DB%8C%D8%AA%20%D8%AF%D8%A7%D9%86%D9%84%D9%88%D8%AF%20Beat%20the%20Boss%204%201.1.2%20%E2%80%93%20%D8%A8%D8%A7%D8%B2%DB%8C%20%D8%B6%D8%B1%D8%A8%20%D9%88%20%D8%B4%D8%AA%D9%85%20%D8%B1%D8%A6%DB%8C%D8%B3%204%20%D8%A7%D9%86%D8%AF%D8%B1%D9%88%DB%8C%D8%AF%20%2B%20%D9%85%D9%88%D8%AF%20%2B%20%D8%AF%DB%8C%D8%AA%D8%A7", "post_title_5": "آپدیت دانلود Beat the Boss 4 1.1.2 – بازی ضرب و شتم رئیس 4 اندروید + مود + دیتا", "post_content_5": "\nنسخه چهارم از بازی محبوب و هیجان انگیز ضرب و شتم رئیس از استودیوی Game Hive Corporation برای اندروید\n است که همین چند دقیقه پیش شاهد عرضه شدن نسخه جدید ان در پلی استور بودیم\n و باز هم مثل همیشه تصمیم گرفتیم پیشگام شویم و برای اولین بار در ایران \nان را حضور شما دوستداران بازی های تسکین استرس معرفی نماییم! رئیس برگشته \nاست تا زندگی را برای شما به جهنم تبدیل کند اما شما نیز از آن کارمندانی \nنیستید که به همه ی حرف های رئیس خود گوش دهید و همه ی آن ها را مو به مو \nانجام دهید، پس به مبارزه با او می پردازید! در این بازی همانند نسخه های \nقبلی شما با سلاح های مختلف و مرگبار رئیس خود را مورد ضرب و شتم قرار می \nدهید و به نوعی خشم خود را خالی می کنید! بله… شما می بایست با انواع و \nاقسام سلاح های سبک و سنگینی که در اختیار دارید، رئیس خود را مورد ضرب و \nشتم قرار دهید و او را برای جمع آوری امتیازهای مختلف کتک کاری کنید! آیا \nشما نیز مایلید رئیستان را مورد ضرب و شتم قرار دهید و به زجر آورترین روش \nهای ممکن او را شکنجه کنید؟! اگر جواب مثبت است، پس آماده باشید تا با \nابزارها و سلاح های مختلفی که در اختیار دارید رئیس خود را شکنجه کنید و \nبا Beat the Boss 4 یکی از مهیج ترین بازی اندرویدی را تجربه کنید! نسخه چهارم نسبت به نسخه های قبلی پیشرفت واقعا چشمگیری داشته و حجم ان نسبت به نسخه سوم دو برابر شده است!\n\nادامه مطلب", "post_full_content_2": "\nجدید دانلود Duet Premium Edition 3.8 – بازی آرکید اعتیادآور “دوئت” اندروید + اورجینال\n\nبازی محبوب و فوق العاده زیبا با گیم پلی اعتیاداور و صداگذاری دلربا از استودیوی بازی سازی Kumobius برای دستگاه های اندروید\n است که به صورت رایگان در گوگل پلی عرضه شده و تا به این لحظه بیش از \nپانصد میلیون بار توسط کاربران اندرویدی سراسر جهان دریافت شده و از \nپردانلودترین ها به شمار می رود و امروز در فارسروید قصد معرفی نسخه اصلی و\n پرمیوم ان را حضور شما کاربران عزیز و همیشگی داریم! در بازی Duet شما \nچرخش دو توپ رنگی یکی قرمز و دیگری آبی را برعهده می گیرید، با لمس سمت \nراست صفحه توپ ها در جهت ساعت گرد و با لمس نیمه سمت چپ توپ ها در جهت \nپادساعت‌گرد شروع به چرخش می کنند و هدف بازی این است که شما به سلامت از \nمیان موانع گذشته و به پایان مسیر برسید! در راه موانع ثابت و متحرک زیادی \nرا در پیش رو دارید و می بایست با دقت هرچه تمام تر طوری توپ ها را \nبچرخانید که بدون برخورد به موانع از لا به لای آنها عبور کنند ؛ چرا که \nاگر با آن ها برخورد کنید توپ ترکیده و مانند یک گلوگه پینت بال مانع را \nرنگ آمیزی می کند! به طور کلی Duet بسیار ساده طراحی شده و تا حد امکان سعی\n شده از زرق و برق های گرافیکی در آن دوری شود ؛ به جای جلوه های بصری سعی \nشده تا به شیوه بازی، نحوه بازی با ذهن کاربر و نوشته هایی که بر روی صفحه \nبرای بازی با اعصاب شما نمایان می‌شود تمرکز گردد!\n\n\n\nبرخی از ویژگی های بازی آرکید Duet Premium Edition اندروید :\n\nدارای 8 فصل مختلف که هر کدام به توان ذهنی بالا  و ریزه کاری های خود نیاز دارد\nامکان انجام مجدد هر مرحله برای افزایش مهارت های خود و باز کردن قفل بیش از 25 دستاورد\nباز کردن قفل حالت های مختلف دوام آوردن، بازی های روزانه و چهار حالت اضافی دیگر\nدارای 9 موسیقی متن بسیار زیبا که شما را در حال و هوای بازی فرو میبرند\nطراحی و ساخت فوق العاده با صداگذاری هیجان اور و کنترلرهای لمسی ساده و کاربرپسند\n\n دانلود فایل نصبی پرمیوم بازی با لینک مستقیم - 59 مگابایت \n\nدانلود فایل نصبی اصلی بازی با لینک مستقیم - 59 مگابایت\n\n\nمنبع:فارسروید\n\n\n\n۹۶/۰۱/۱۶\n\n\n\n\n۰\n\n\n\n\n\n۰\n\n\n\n\n\nERFAN Hjizadehe\n\n\n\n\n\n\n\n\n\n\n\n\n\n\nبینندگان عزیز برای رفتن به ادامه مطلب سمت چپ  شکل مثلث را بزنید و وارد شوید .در این وبلاگ بهترین بازی های اندروید و پربازدید ترین بازی ها گذاشته می شود \n\n\n\n\n\n\n\nupdateSearchBoxTheme('srchBx')\n\n\n\n\t\t\t\tدنبال کنندگان\n\t\t\t\t\n\t\t\t\t\t\t۸۳\n\t\t\t\t\tنفر\n\t\t\t\t\n\n\n\n\n\n\n\n\n\n\n\n\n\n\n\n\n\n\n\n\n\n\n\n\n\n\n\n\n\n\n\n\n\n\n\n\n\n\n\n\n\n\n\n\n\n\n\n\n\n\n\n\n\n\n\n\n\n\n\n\n\n\n\n\n\n\t\t\t\tاین وبلاگ را دنبال کنید\n\t\t\t\n\n\n\n\n\nطبقه بندی موضوعی\n\n\n\nترفندهای ویندوزی  (۲۵۹)\n\n\nاستراتژیک  (۵۰)\n\n\nاکشن  (۸۶)\n\n\nمسابقه ای  (۱۷)\n\n\nورزشی  (۲۹)\n\n\nموتور و ماشین  (۳۳)\n\n\nکودکانه  (۲۵)\n\n\nانلاین  (۵۴)\n\n\nماجراجویی  (۸۰)\n\n\nبرنامه های خاص  (۳۸)\n\n\nفکری  (۶۳)\n\n\nترسناک  (۱۱)\n\n\n\n\n\n\nخلاصه آمار\n\n\n\n\n\n\n\n\n\n\nکلمات کلیدی\n\nمشاهده پسورد Wi-Fi ذخیره شده در گوشی های اندروید + آموزش تصویری\nافزایش سرعت ویندوز 10 + نکته های طلایی ویندوز 10\nنمایش روز و تاریخ موجود در صفحه‌ی Lock ویندوز 8 به زبان فارسی\nتشخیص اصل بودن گوشی از طریق اینترنت\nآموزش جلوگیری از هک تلگرام و افزایش امنیت آن\nآموزش روت کردن تمام گوشی های اندروید\nارسال SMS رایگان توسط ایرانسل در مواقع اضطراری!\nنظیماتی برای اجرای بهتر بازی‌ها در ویندوز\nذخیره‌ی نقشه‌های Google Maps برای استفاده‌ی آفلاین در اندروید\n4 راز که هکرهای شبکه‌های وایرلس نمی‌خواهند شما بدانید!\nزودتر از دیگران قابلیت‌های جدید ویندوز 10 را آزمایش کنید\nکاهش حجم اشغال‌شده‌ی درایو C با حذف آپدیت‌های قدیمی\n\n\n\nآخرین مطلب\n\n\n\n۹۶/۰۱/۱۶\nدانلود Age of Empires: Castle Siege 1.23.199 بازی استراتژی خارق العاده “عصر فرمانروایان + دیتا\n\n\n۹۶/۰۱/۱۶\nجدید دانلود Duet Premium Edition 3.8 – بازی آرکید اعتیادآور “دوئت” اندروید + اورجینال\n\n\n۹۶/۰۱/۱۶\nآپدیت دانلود Darkness and Flame Full 1.0.8 – بازی فکری عالی “زاده آتش” اندروید + دیتا\n\n\n۹۶/۰۱/۱۶\nآپدیت دانلود NBA LIVE Mobile Basketball 1.5.2 – بازی بسکتبال NBA اندروید !\n\n\n۹۶/۰۱/۱۶\nآپدیت دانلود Beat the Boss 4 1.1.2 – بازی ضرب و شتم رئیس 4 اندروید + مود + دیتا\n\n\n۹۶/۰۱/۱۶\nآپدیت دانلود Desert Storm 5.0 – بازی اکشن عالی “طوفان صحرا” اندروید + دیتا\n\n\n۹۶/۰۱/۱۶\nآپدیت دانلود FarmVille: Tropic Escape 1.5.579 – بازی شبیه سازی جنگل استوایی اندروید + مود\n\n\n۹۶/۰۱/۱۶\nآپدیت دانلود بازی نظم و آشوب 2 اندروید – Order  Chaos 2: Redemption 1.9.0l\n\n\n۹۶/۰۱/۱۶\nآپدیت دانلود Final kick: Online football 5.7 – بازی پنالتی ضربات نهایی اندروید + مود + دیتا\n\n\n۹۶/۰۱/۱۶\nآپدیت دانلود Warp Shift 1.0.6 – بازی پازل فوق العاده اندروید + مود + دیتا\n\n\n\n\n\nپربیننده ترین مطالب\n\n\n\n۹۵/۱۲/۱۴\nآپدیت دانلود Gardenscapes – New Acres 1.3.4 – بازی جورچین “باغداری” اندروید + مود\n\n\n۹۵/۱۲/۰۱\nبرنامه هک بازی های اندروید بدون نیاز به روت و با روت\n\n\n۹۵/۰۵/۰۶\nحل مشکل ارور سریال تقلبی Fake Serial Number در IDM\n\n\n۹۶/۰۱/۰۶\nآپدیت دانلود Minecraft – Pocket Edition 1.0.6.0 – بازی ماینکرافت اندروید + مود\n\n\n۹۵/۰۵/۰۵\nآیکون پوشه های ویندوز 10 را به تصویر دلخواه تغییر دهید + تصویر\n\n\n۹۶/۰۱/۰۳\nآپدیت دانلود Dream League Soccer 2017 4.02 – بازی لیگ فوتبال رویایی 2017 اندروید + مود + دیتا\n\n\n۹۵/۰۵/۰۹\nآموزش ساخت ربات تلگرام بدون سرور و برنامه نویسی با Zapier و Paquebot\n\n\n۹۶/۰۱/۰۱\nآپدیت دانلود Township 4.6.2 – بازی شبیه ساز مزرعه اندروید + مود\n\n\n۹۶/۰۱/۱۴\nآپدیت دانلود FIFA Mobile Soccer 5.0.1 – بازی فوتبال “فیفا موبایل” اندروید\n\n\n۹۶/۰۱/۰۶\nآپدیت دانلود Doodle Army 2 : Mini Militia 3.0.87 – بازی اکشن ارتش احمق اندروید + مود\n\n\n\n\n\nمحبوب ترین مطالب\n\n\n\n۹۵/۰۵/۰۲\nدیگر فلش‏ دیسک خود را جا نگذارید!\n\n\n۹۵/۰۴/۲۶\nیک روش ساده اما کارآمد جهت حفاظت از رمز عبور\n\n\n۹۵/۰۵/۰۲\n10 ترفند برای افزایش طول عمر CDها\n\n\n۹۵/۰۵/۰۱\nآموزش ویندوز 10: رفع مشکل ناپدید شدن گزینه Open with در منوی راست کلیک\n\n\n۹۵/۰۵/۰۷\nآموزش استفاده از Google Maps به صورت آفلاین | دانلود آخرین ورژن\n\n\n۹۵/۰۵/۰۵\nآموزش بازگرداندن ویندوز 10 به ویندوز 7 یا 8 یا 8.1 + کاملا تصویری\n\n\n۹۵/۰۴/۲۲\nجلوگیری از دو تکه شدن یک پاراگراف در میان صفحات در Word\n\n\n۹۵/۰۵/۰۲\nنامرئی کردن فولدرها!\n\n\n۹۵/۰۵/۰۵\nافزایش سرعت ویندوز 10 + نکته های طلایی ویندوز 10\n\n\n۹۵/۰۴/۱۹\nافزودن This PC به صفحه‌ی Desktop ویندوز 10\n\n\n\n\n\nپیوندها\n\n\n\nفوتبال جهان\n\n\n\n\n\n\n\n\n\n\nقدرت گرفته از بلاگ بیان\n\n\n\n\n\n\n\n\n\n\n", "post_full_content_5": "\nآپدیت دانلود Beat the Boss 4 1.1.2 – بازی ضرب و شتم رئیس 4 اندروید + مود + دیتا\n\nنسخه چهارم از بازی محبوب و هیجان انگیز ضرب و شتم رئیس از استودیوی Game Hive Corporation برای اندروید\n است که همین چند دقیقه پیش شاهد عرضه شدن نسخه جدید ان در پلی استور بودیم\n و باز هم مثل همیشه تصمیم گرفتیم پیشگام شویم و برای اولین بار در ایران \nان را حضور شما دوستداران بازی های تسکین استرس معرفی نماییم! رئیس برگشته \nاست تا زندگی را برای شما به جهنم تبدیل کند اما شما نیز از آن کارمندانی \nنیستید که به همه ی حرف های رئیس خود گوش دهید و همه ی آن ها را مو به مو \nانجام دهید، پس به مبارزه با او می پردازید! در این بازی همانند نسخه های \nقبلی شما با سلاح های مختلف و مرگبار رئیس خود را مورد ضرب و شتم قرار می \nدهید و به نوعی خشم خود را خالی می کنید! بله… شما می بایست با انواع و \nاقسام سلاح های سبک و سنگینی که در اختیار دارید، رئیس خود را مورد ضرب و \nشتم قرار دهید و او را برای جمع آوری امتیازهای مختلف کتک کاری کنید! آیا \nشما نیز مایلید رئیستان را مورد ضرب و شتم قرار دهید و به زجر آورترین روش \nهای ممکن او را شکنجه کنید؟! اگر جواب مثبت است، پس آماده باشید تا با \nابزارها و سلاح های مختلفی که در اختیار دارید رئیس خود را شکنجه کنید و \nبا Beat the Boss 4 یکی از مهیج ترین بازی اندرویدی را تجربه کنید! نسخه چهارم نسبت به نسخه های قبلی پیشرفت واقعا چشمگیری داشته و حجم ان نسبت به نسخه سوم دو برابر شده است!\n\n\nبرخی از ویژگی های بازی هیجان انگیز Beat the Boss 4 اندروید:\n\nجهان همه جانبه با 10 نقشه و 30 مرحله تعاملی\nامکان سفارشی کردن همه چیز: سلاح، رئیس، مراحل\nشامل بیش از 130 سلاح برای سرگرم کردن شما\nبودن بیش از 180 کارفرمای مختلف برای ضرب و شتم\nامکان بازی به صورت چندنفره و کتک کاری چند نفره\nعکس العمل نشان دادن رئیس هنگام کتک خوردن\nطراحی رنگارنگ، گرافیک اچ دی و صداگذاری مهیج\n\n\nدستورالعمل نصب و اجرای بازی Beat the Boss 4 :\n– ابتدا فایل نصبی بازی را دانلود و نصب کنید.\n– فایل دیتا را دانلود و ان را از حالت فشرده خارج کنید. پوشه com.gamehivecorp.beattheboss4 را در مسیر Android/Obb حافظه داخلی دستگاه کپی کنید.\n– بازی را اجرا کنید.\n\n دانلود فایل نصبی معمولی با لینک مستقیم - 25 مگابایت\n\n دانلود فایل نصبی مـــــــود با لینک مستقیم - 25 مگابایت\n\n دانلود فایل دیتای بازی با لینک مستقیم - 133 مگابایت\n\n\nمنبع:فارسروید\n\n\n۹۶/۰۱/۱۶\n\n\n\n\n۰\n\n\n\n\n\n۰\n\n\n\n\n\nERFAN Hjizadehe\n\n\n\n\n\n\n\n\n\n\n\n\n\n\nبینندگان عزیز برای رفتن به ادامه مطلب سمت چپ  شکل مثلث را بزنید و وارد شوید .در این وبلاگ بهترین بازی های اندروید و پربازدید ترین بازی ها گذاشته می شود \n\n\n\n\n\n\n\nupdateSearchBoxTheme('srchBx')\n\n\n\n\t\t\t\tدنبال کنندگان\n\t\t\t\t\n\t\t\t\t\t\t۸۳\n\t\t\t\t\tنفر\n\t\t\t\t\n\n\n\n\n\n\n\n\n\n\n\n\n\n\n\n\n\n\n\n\n\n\n\n\n\n\n\n\n\n\n\n\n\n\n\n\n\n\n\n\n\n\n\n\n\n\n\n\n\n\n\n\n\n\n\n\n\n\n\n\n\n\n\n\n\n\t\t\t\tاین وبلاگ را دنبال کنید\n\t\t\t\n\n\n\n\n\nطبقه بندی موضوعی\n\n\n\nترفندهای ویندوزی  (۲۵۹)\n\n\nاستراتژیک  (۵۰)\n\n\nاکشن  (۸۶)\n\n\nمسابقه ای  (۱۷)\n\n\nورزشی  (۲۹)\n\n\nموتور و ماشین  (۳۳)\n\n\nکودکانه  (۲۵)\n\n\nانلاین  (۵۴)\n\n\nماجراجویی  (۸۰)\n\n\nبرنامه های خاص  (۳۸)\n\n\nفکری  (۶۳)\n\n\nترسناک  (۱۱)\n\n\n\n\n\n\nخلاصه آمار\n\n\n\n\n\n\n\n\n\n\nکلمات کلیدی\n\nمشاهده پسورد Wi-Fi ذخیره شده در گوشی های اندروید + آموزش تصویری\nافزایش سرعت ویندوز 10 + نکته های طلایی ویندوز 10\nنمایش روز و تاریخ موجود در صفحه‌ی Lock ویندوز 8 به زبان فارسی\nتشخیص اصل بودن گوشی از طریق اینترنت\nآموزش جلوگیری از هک تلگرام و افزایش امنیت آن\nآموزش روت کردن تمام گوشی های اندروید\nارسال SMS رایگان توسط ایرانسل در مواقع اضطراری!\nنظیماتی برای اجرای بهتر بازی‌ها در ویندوز\nذخیره‌ی نقشه‌های Google Maps برای استفاده‌ی آفلاین در اندروید\n4 راز که هکرهای شبکه‌های وایرلس نمی‌خواهند شما بدانید!\nزودتر از دیگران قابلیت‌های جدید ویندوز 10 را آزمایش کنید\nکاهش حجم اشغال‌شده‌ی درایو C با حذف آپدیت‌های قدیمی\n\n\n\nآخرین مطلب\n\n\n\n۹۶/۰۱/۱۶\nدانلود Age of Empires: Castle Siege 1.23.199 بازی استراتژی خارق العاده “عصر فرمانروایان + دیتا\n\n\n۹۶/۰۱/۱۶\nجدید دانلود Duet Premium Edition 3.8 – بازی آرکید اعتیادآور “دوئت” اندروید + اورجینال\n\n\n۹۶/۰۱/۱۶\nآپدیت دانلود Darkness and Flame Full 1.0.8 – بازی فکری عالی “زاده آتش” اندروید + دیتا\n\n\n۹۶/۰۱/۱۶\nآپدیت دانلود NBA LIVE Mobile Basketball 1.5.2 – بازی بسکتبال NBA اندروید !\n\n\n۹۶/۰۱/۱۶\nآپدیت دانلود Beat the Boss 4 1.1.2 – بازی ضرب و شتم رئیس 4 اندروید + مود + دیتا\n\n\n۹۶/۰۱/۱۶\nآپدیت دانلود Desert Storm 5.0 – بازی اکشن عالی “طوفان صحرا” اندروید + دیتا\n\n\n۹۶/۰۱/۱۶\nآپدیت دانلود FarmVille: Tropic Escape 1.5.579 – بازی شبیه سازی جنگل استوایی اندروید + مود\n\n\n۹۶/۰۱/۱۶\nآپدیت دانلود بازی نظم و آشوب 2 اندروید – Order  Chaos 2: Redemption 1.9.0l\n\n\n۹۶/۰۱/۱۶\nآپدیت دانلود Final kick: Online football 5.7 – بازی پنالتی ضربات نهایی اندروید + مود + دیتا\n\n\n۹۶/۰۱/۱۶\nآپدیت دانلود Warp Shift 1.0.6 – بازی پازل فوق العاده اندروید + مود + دیتا\n\n\n\n\n\nپربیننده ترین مطالب\n\n\n\n۹۵/۱۲/۱۴\nآپدیت دانلود Gardenscapes – New Acres 1.3.4 – بازی جورچین “باغداری” اندروید + مود\n\n\n۹۵/۱۲/۰۱\nبرنامه هک بازی های اندروید بدون نیاز به روت و با روت\n\n\n۹۵/۰۵/۰۶\nحل مشکل ارور سریال تقلبی Fake Serial Number در IDM\n\n\n۹۶/۰۱/۰۶\nآپدیت دانلود Minecraft – Pocket Edition 1.0.6.0 – بازی ماینکرافت اندروید + مود\n\n\n۹۵/۰۵/۰۵\nآیکون پوشه های ویندوز 10 را به تصویر دلخواه تغییر دهید + تصویر\n\n\n۹۶/۰۱/۰۳\nآپدیت دانلود Dream League Soccer 2017 4.02 – بازی لیگ فوتبال رویایی 2017 اندروید + مود + دیتا\n\n\n۹۵/۰۵/۰۹\nآموزش ساخت ربات تلگرام بدون سرور و برنامه نویسی با Zapier و Paquebot\n\n\n۹۶/۰۱/۰۱\nآپدیت دانلود Township 4.6.2 – بازی شبیه ساز مزرعه اندروید + مود\n\n\n۹۶/۰۱/۱۴\nآپدیت دانلود FIFA Mobile Soccer 5.0.1 – بازی فوتبال “فیفا موبایل” اندروید\n\n\n۹۶/۰۱/۰۶\nآپدیت دانلود Doodle Army 2 : Mini Militia 3.0.87 – بازی اکشن ارتش احمق اندروید + مود\n\n\n\n\n\nمحبوب ترین مطالب\n\n\n\n۹۵/۰۵/۰۲\nدیگر فلش‏ دیسک خود را جا نگذارید!\n\n\n۹۵/۰۴/۲۶\nیک روش ساده اما کارآمد جهت حفاظت از رمز عبور\n\n\n۹۵/۰۵/۰۲\n10 ترفند برای افزایش طول عمر CDها\n\n\n۹۵/۰۵/۰۱\nآموزش ویندوز 10: رفع مشکل ناپدید شدن گزینه Open with در منوی راست کلیک\n\n\n۹۵/۰۵/۰۷\nآموزش استفاده از Google Maps به صورت آفلاین | دانلود آخرین ورژن\n\n\n۹۵/۰۵/۰۵\nآموزش بازگرداندن ویندوز 10 به ویندوز 7 یا 8 یا 8.1 + کاملا تصویری\n\n\n۹۵/۰۴/۲۲\nجلوگیری از دو تکه شدن یک پاراگراف در میان صفحات در Word\n\n\n۹۵/۰۵/۰۲\nنامرئی کردن فولدرها!\n\n\n۹۵/۰۵/۰۵\nافزایش سرعت ویندوز 10 + نکته های طلایی ویندوز 10\n\n\n۹۵/۰۴/۱۹\nافزودن This PC به صفحه‌ی Desktop ویندوز 10\n\n\n\n\n\nپیوندها\n\n\n\nفوتبال جهان\n\n\n\n\n\n\n\n\n\n\nقدرت گرفته از بلاگ بیان\n\n\n\n\n\n\n\n\n\n\n", "post_full_content_1": "\nدانلود Age of Empires: Castle Siege 1.23.199 بازی استراتژی خارق العاده “عصر فرمانروایان + دیتا\n\nبه فارسی “عصر فرمانروایان: محاصره قلعه” بازی جدید و خارق العاده در سبک بازیهای استراتژی از کمپانی محبوب Microsoft Corporation برای اندروید است که چند دقیقه پیش به صورت رایگان در مارکت بزرگ گوگل منتشر شد و باز هم مثل همیشه تصمیم گرفتیم برای اولین بار در ایران\n ان را حضور شما دوستداران بازیهای استراتژی اندروید معرفی کنیم و برای بار\n دیگر شما را به وجد بیاوریم! در این بازی شما قادر هستید متناسب با میل \nخود یکی از امپراطوری های بریتانیا، بیزانس(روم شرقی)، فرانسوی ها، روس ها،\n اعراب و یا آلمان تئوتونیک را برگزینید و شروع به ساخت سرزمین اختصاصی خود\n نمایید و سپس با ساخت و آموزش سربازانی سلحشور به نبرد با کاربران آنلاین \nسراسر جهان بپردازید و ساعت ها مشعول شوید! سبک بازی همانند بازی محبوب Clash Of Clans\n هست که در آن شما باید با ایجاد و ساخت امپراطوری قدرتمند مانع از نفوذ \nدشمنان شوید و از طرف دیگر با آموزش نیروهایی قدرتمند به نبرد با کاربران \nآنلاین سراسر جهان بپردازید و با به سرقت بردن منابع، قدرت خود را افزایش \nدهید! بازی Age of Empires: Castle Siege دارای گرافیک خیره کننده اچ دی، \nصداگذاری فوق العاده، کنترلرهای عالی، ساخت بی نظیر و گیم پلی اعتیاداوری \nاست که ان را به همه علاقه مندان به بازیهای استراتژی پیشنهاد می دهیم!\n\n \nدستورالعمل نصب و اجرای بازی :\n– ابتدا فایل نصبی بازی را دانلود و نصب کنید.\n– فایل دیتا را دانلود و ان را از حالت فشرده خارج سازید. پوشه ی com.microsoft.ageofempirescastlesiege را در مسیر Android/Obb حافظه داخلی دستگاه کپی کنید.\n\n دانلود فایل نصبی بازی با لینک مستقیم - 66 مگابایت\n\n دانلود فایل دیتای بازی با لینک مستقیم - 246 مگابایت\n\n\nمنبع:فارسروید\n– بازی را اجرا کنید و لذت ببرید.\n\n\n\n\n\n۹۶/۰۱/۱۶\n\n\n\n\n۱\n\n\n\n\n\n۰\n\n\n\n\n\nERFAN Hjizadehe\n\n\n\n\n\n\n\n\n\n\n\n\n\n\nبینندگان عزیز برای رفتن به ادامه مطلب سمت چپ  شکل مثلث را بزنید و وارد شوید .در این وبلاگ بهترین بازی های اندروید و پربازدید ترین بازی ها گذاشته می شود \n\n\n\n\n\n\n\nupdateSearchBoxTheme('srchBx')\n\n\n\n\t\t\t\tدنبال کنندگان\n\t\t\t\t\n\t\t\t\t\t\t۸۳\n\t\t\t\t\tنفر\n\t\t\t\t\n\n\n\n\n\n\n\n\n\n\n\n\n\n\n\n\n\n\n\n\n\n\n\n\n\n\n\n\n\n\n\n\n\n\n\n\n\n\n\n\n\n\n\n\n\n\n\n\n\n\n\n\n\n\n\n\n\n\n\n\n\n\n\n\n\n\t\t\t\tاین وبلاگ را دنبال کنید\n\t\t\t\n\n\n\n\n\nطبقه بندی موضوعی\n\n\n\nترفندهای ویندوزی  (۲۵۹)\n\n\nاستراتژیک  (۵۰)\n\n\nاکشن  (۸۶)\n\n\nمسابقه ای  (۱۷)\n\n\nورزشی  (۲۹)\n\n\nموتور و ماشین  (۳۳)\n\n\nکودکانه  (۲۵)\n\n\nانلاین  (۵۴)\n\n\nماجراجویی  (۸۰)\n\n\nبرنامه های خاص  (۳۸)\n\n\nفکری  (۶۳)\n\n\nترسناک  (۱۱)\n\n\n\n\n\n\nخلاصه آمار\n\n\n\n\n\n\n\n\n\n\nکلمات کلیدی\n\nمشاهده پسورد Wi-Fi ذخیره شده در گوشی های اندروید + آموزش تصویری\nافزایش سرعت ویندوز 10 + نکته های طلایی ویندوز 10\nنمایش روز و تاریخ موجود در صفحه‌ی Lock ویندوز 8 به زبان فارسی\nتشخیص اصل بودن گوشی از طریق اینترنت\nآموزش جلوگیری از هک تلگرام و افزایش امنیت آن\nآموزش روت کردن تمام گوشی های اندروید\nارسال SMS رایگان توسط ایرانسل در مواقع اضطراری!\nنظیماتی برای اجرای بهتر بازی‌ها در ویندوز\nذخیره‌ی نقشه‌های Google Maps برای استفاده‌ی آفلاین در اندروید\n4 راز که هکرهای شبکه‌های وایرلس نمی‌خواهند شما بدانید!\nزودتر از دیگران قابلیت‌های جدید ویندوز 10 را آزمایش کنید\nکاهش حجم اشغال‌شده‌ی درایو C با حذف آپدیت‌های قدیمی\n\n\n\nآخرین مطلب\n\n\n\n۹۶/۰۱/۱۶\nدانلود Age of Empires: Castle Siege 1.23.199 بازی استراتژی خارق العاده “عصر فرمانروایان + دیتا\n\n\n۹۶/۰۱/۱۶\nجدید دانلود Duet Premium Edition 3.8 – بازی آرکید اعتیادآور “دوئت” اندروید + اورجینال\n\n\n۹۶/۰۱/۱۶\nآپدیت دانلود Darkness and Flame Full 1.0.8 – بازی فکری عالی “زاده آتش” اندروید + دیتا\n\n\n۹۶/۰۱/۱۶\nآپدیت دانلود NBA LIVE Mobile Basketball 1.5.2 – بازی بسکتبال NBA اندروید !\n\n\n۹۶/۰۱/۱۶\nآپدیت دانلود Beat the Boss 4 1.1.2 – بازی ضرب و شتم رئیس 4 اندروید + مود + دیتا\n\n\n۹۶/۰۱/۱۶\nآپدیت دانلود Desert Storm 5.0 – بازی اکشن عالی “طوفان صحرا” اندروید + دیتا\n\n\n۹۶/۰۱/۱۶\nآپدیت دانلود FarmVille: Tropic Escape 1.5.579 – بازی شبیه سازی جنگل استوایی اندروید + مود\n\n\n۹۶/۰۱/۱۶\nآپدیت دانلود بازی نظم و آشوب 2 اندروید – Order  Chaos 2: Redemption 1.9.0l\n\n\n۹۶/۰۱/۱۶\nآپدیت دانلود Final kick: Online football 5.7 – بازی پنالتی ضربات نهایی اندروید + مود + دیتا\n\n\n۹۶/۰۱/۱۶\nآپدیت دانلود Warp Shift 1.0.6 – بازی پازل فوق العاده اندروید + مود + دیتا\n\n\n\n\n\nپربیننده ترین مطالب\n\n\n\n۹۵/۱۲/۱۴\nآپدیت دانلود Gardenscapes – New Acres 1.3.4 – بازی جورچین “باغداری” اندروید + مود\n\n\n۹۵/۱۲/۰۱\nبرنامه هک بازی های اندروید بدون نیاز به روت و با روت\n\n\n۹۵/۰۵/۰۶\nحل مشکل ارور سریال تقلبی Fake Serial Number در IDM\n\n\n۹۶/۰۱/۰۶\nآپدیت دانلود Minecraft – Pocket Edition 1.0.6.0 – بازی ماینکرافت اندروید + مود\n\n\n۹۵/۰۵/۰۵\nآیکون پوشه های ویندوز 10 را به تصویر دلخواه تغییر دهید + تصویر\n\n\n۹۶/۰۱/۰۳\nآپدیت دانلود Dream League Soccer 2017 4.02 – بازی لیگ فوتبال رویایی 2017 اندروید + مود + دیتا\n\n\n۹۵/۰۵/۰۹\nآموزش ساخت ربات تلگرام بدون سرور و برنامه نویسی با Zapier و Paquebot\n\n\n۹۶/۰۱/۰۱\nآپدیت دانلود Township 4.6.2 – بازی شبیه ساز مزرعه اندروید + مود\n\n\n۹۶/۰۱/۱۴\nآپدیت دانلود FIFA Mobile Soccer 5.0.1 – بازی فوتبال “فیفا موبایل” اندروید\n\n\n۹۶/۰۱/۰۶\nآپدیت دانلود Doodle Army 2 : Mini Militia 3.0.87 – بازی اکشن ارتش احمق اندروید + مود\n\n\n\n\n\nمحبوب ترین مطالب\n\n\n\n۹۵/۰۵/۰۲\nدیگر فلش‏ دیسک خود را جا نگذارید!\n\n\n۹۵/۰۴/۲۶\nیک روش ساده اما کارآمد جهت حفاظت از رمز عبور\n\n\n۹۵/۰۵/۰۲\n10 ترفند برای افزایش طول عمر CDها\n\n\n۹۵/۰۵/۰۱\nآموزش ویندوز 10: رفع مشکل ناپدید شدن گزینه Open with در منوی راست کلیک\n\n\n۹۵/۰۵/۰۷\nآموزش استفاده از Google Maps به صورت آفلاین | دانلود آخرین ورژن\n\n\n۹۵/۰۵/۰۵\nآموزش بازگرداندن ویندوز 10 به ویندوز 7 یا 8 یا 8.1 + کاملا تصویری\n\n\n۹۵/۰۴/۲۲\nجلوگیری از دو تکه شدن یک پاراگراف در میان صفحات در Word\n\n\n۹۵/۰۵/۰۲\nنامرئی کردن فولدرها!\n\n\n۹۵/۰۵/۰۵\nافزایش سرعت ویندوز 10 + نکته های طلایی ویندوز 10\n\n\n۹۵/۰۴/۱۹\nافزودن This PC به صفحه‌ی Desktop ویندوز 10\n\n\n\n\n\nپیوندها\n\n\n\nفوتبال جهان\n\n\n\n\n\n\n\n\n\n\nقدرت گرفته از بلاگ بیان\n\n\n\n\n\n\n\n\n\n\n", "post_full_content_3": "\nآپدیت دانلود Darkness and Flame Full 1.0.8 – بازی فکری عالی “زاده آتش” اندروید + دیتا\n\nبازی جدید و فوق العاده زیبا تحت عنوان “تاریکی و شعله: زاده آتش” از FIVE-BN GAMES برای اندروید است که ساعت ها پیش با قیمت 2.99 دلار در\n پلی استور عرضه شد و مثل همیشه تصمیم بر این شد تا در اسرع وقت و برای \nاولین بار در ایران نسخه پولی و خریداری شده ان را حضور شما دوستداران بازی\n های فکری و ماجراجویی معرفی کنیم! داستان بازی را اینگونه از زبان سازنده \nبیان می کنیم: “آلیس فقط یک دختر معمولی بود تا زمان یکه او تخم مرغی را در\n یک قفسه عجیب و غریب پیدا کرد و بعد از آن زندگی اش دچار حوادث و اتفاقات \nمرموزی گردید که باعث شد او خانه اش را ترک کند و ماجراجویی پر فراز و \nنشیبی را پشت سر بگذارد! آیا شما می توانید شجاعت او را بازگردانید تا بر \nسرنوشت فعلی اش غلبه کند!؟ ” در این بازی شما به عنوان یک بازیکن باید صدها\n پازل و مینی گیم مختلف را پشت سر بگذارید و با پیدا کردن هزاران شیء مخفی \nداستان بازی را پشت سر بگذارید و ساعت ها خود را سرگرم سازید! اگر از علاقه\n مندان به بازی های شیء مخفی و پازلی اندروید باشید بدون شک Darkness and Flame نظر شما را جل خواهد کرد.\n\n\nبرخی از ویژگی های بازی فکری Darkness and Flame Full اندروید:\n\nتجربه یک بازی عالی با یک ماجراجویی شگفت انگیز در دنیای فانتزی\nملاقات با انواع شخصیت ها و کارکترهای مختلف\nحل و پشت سر گذاشتن ده ها مورد از پازل های مختلف\nبه چالش کشاندن شما با انواع صحنه های پنهان شیء تعاملی\nگرافیک اچ دی، صداگذاری هیجان انگیز و کنترلرهای لمسی خوب\nبهینه شده برای تبلت ها و گوشی های اندرویدی با صفحه نمایش بزرگ و کوچک\n\nدستورالعمل نصب و اجرای بازی Darkness and Flame Full Games :\n– ابتدا فایل نصبی را دانلود و نصب کنید.\n– فایل دیتای بازی را دانلود و آن را از حالت فشرده خارج کنید. پوشه ی com.fivebn.daf1.full را در مسیر Android/Obb حافظه داخلی کپی کنید.\n– بازی را اجرا نمایید.\n\n دانلود فایل نصبی کامل با لینک مستقیم - 6 مگابایت\n\n دانلود فایل دیتای کامل با لینک مستقیم - 598 مگابایت\n\n\nمنبع:فارسروید\n\n\n\n۹۶/۰۱/۱۶\n\n\n\n\n۰\n\n\n\n\n\n۰\n\n\n\n\n\nERFAN Hjizadehe\n\n\n\n\n\n\n\n\n\n\n\n\n\n\nبینندگان عزیز برای رفتن به ادامه مطلب سمت چپ  شکل مثلث را بزنید و وارد شوید .در این وبلاگ بهترین بازی های اندروید و پربازدید ترین بازی ها گذاشته می شود \n\n\n\n\n\n\n\nupdateSearchBoxTheme('srchBx')\n\n\n\n\t\t\t\tدنبال کنندگان\n\t\t\t\t\n\t\t\t\t\t\t۸۳\n\t\t\t\t\tنفر\n\t\t\t\t\n\n\n\n\n\n\n\n\n\n\n\n\n\n\n\n\n\n\n\n\n\n\n\n\n\n\n\n\n\n\n\n\n\n\n\n\n\n\n\n\n\n\n\n\n\n\n\n\n\n\n\n\n\n\n\n\n\n\n\n\n\n\n\n\n\n\t\t\t\tاین وبلاگ را دنبال کنید\n\t\t\t\n\n\n\n\n\nطبقه بندی موضوعی\n\n\n\nترفندهای ویندوزی  (۲۵۹)\n\n\nاستراتژیک  (۵۰)\n\n\nاکشن  (۸۶)\n\n\nمسابقه ای  (۱۷)\n\n\nورزشی  (۲۹)\n\n\nموتور و ماشین  (۳۳)\n\n\nکودکانه  (۲۵)\n\n\nانلاین  (۵۴)\n\n\nماجراجویی  (۸۰)\n\n\nبرنامه های خاص  (۳۸)\n\n\nفکری  (۶۳)\n\n\nترسناک  (۱۱)\n\n\n\n\n\n\nخلاصه آمار\n\n\n\n\n\n\n\n\n\n\nکلمات کلیدی\n\nمشاهده پسورد Wi-Fi ذخیره شده در گوشی های اندروید + آموزش تصویری\nافزایش سرعت ویندوز 10 + نکته های طلایی ویندوز 10\nنمایش روز و تاریخ موجود در صفحه‌ی Lock ویندوز 8 به زبان فارسی\nتشخیص اصل بودن گوشی از طریق اینترنت\nآموزش جلوگیری از هک تلگرام و افزایش امنیت آن\nآموزش روت کردن تمام گوشی های اندروید\nارسال SMS رایگان توسط ایرانسل در مواقع اضطراری!\nنظیماتی برای اجرای بهتر بازی‌ها در ویندوز\nذخیره‌ی نقشه‌های Google Maps برای استفاده‌ی آفلاین در اندروید\n4 راز که هکرهای شبکه‌های وایرلس نمی‌خواهند شما بدانید!\nزودتر از دیگران قابلیت‌های جدید ویندوز 10 را آزمایش کنید\nکاهش حجم اشغال‌شده‌ی درایو C با حذف آپدیت‌های قدیمی\n\n\n\nآخرین مطلب\n\n\n\n۹۶/۰۱/۱۶\nدانلود Age of Empires: Castle Siege 1.23.199 بازی استراتژی خارق العاده “عصر فرمانروایان + دیتا\n\n\n۹۶/۰۱/۱۶\nجدید دانلود Duet Premium Edition 3.8 – بازی آرکید اعتیادآور “دوئت” اندروید + اورجینال\n\n\n۹۶/۰۱/۱۶\nآپدیت دانلود Darkness and Flame Full 1.0.8 – بازی فکری عالی “زاده آتش” اندروید + دیتا\n\n\n۹۶/۰۱/۱۶\nآپدیت دانلود NBA LIVE Mobile Basketball 1.5.2 – بازی بسکتبال NBA اندروید !\n\n\n۹۶/۰۱/۱۶\nآپدیت دانلود Beat the Boss 4 1.1.2 – بازی ضرب و شتم رئیس 4 اندروید + مود + دیتا\n\n\n۹۶/۰۱/۱۶\nآپدیت دانلود Desert Storm 5.0 – بازی اکشن عالی “طوفان صحرا” اندروید + دیتا\n\n\n۹۶/۰۱/۱۶\nآپدیت دانلود FarmVille: Tropic Escape 1.5.579 – بازی شبیه سازی جنگل استوایی اندروید + مود\n\n\n۹۶/۰۱/۱۶\nآپدیت دانلود بازی نظم و آشوب 2 اندروید – Order  Chaos 2: Redemption 1.9.0l\n\n\n۹۶/۰۱/۱۶\nآپدیت دانلود Final kick: Online football 5.7 – بازی پنالتی ضربات نهایی اندروید + مود + دیتا\n\n\n۹۶/۰۱/۱۶\nآپدیت دانلود Warp Shift 1.0.6 – بازی پازل فوق العاده اندروید + مود + دیتا\n\n\n\n\n\nپربیننده ترین مطالب\n\n\n\n۹۵/۱۲/۱۴\nآپدیت دانلود Gardenscapes – New Acres 1.3.4 – بازی جورچین “باغداری” اندروید + مود\n\n\n۹۵/۱۲/۰۱\nبرنامه هک بازی های اندروید بدون نیاز به روت و با روت\n\n\n۹۵/۰۵/۰۶\nحل مشکل ارور سریال تقلبی Fake Serial Number در IDM\n\n\n۹۶/۰۱/۰۶\nآپدیت دانلود Minecraft – Pocket Edition 1.0.6.0 – بازی ماینکرافت اندروید + مود\n\n\n۹۵/۰۵/۰۵\nآیکون پوشه های ویندوز 10 را به تصویر دلخواه تغییر دهید + تصویر\n\n\n۹۶/۰۱/۰۳\nآپدیت دانلود Dream League Soccer 2017 4.02 – بازی لیگ فوتبال رویایی 2017 اندروید + مود + دیتا\n\n\n۹۵/۰۵/۰۹\nآموزش ساخت ربات تلگرام بدون سرور و برنامه نویسی با Zapier و Paquebot\n\n\n۹۶/۰۱/۰۱\nآپدیت دانلود Township 4.6.2 – بازی شبیه ساز مزرعه اندروید + مود\n\n\n۹۶/۰۱/۱۴\nآپدیت دانلود FIFA Mobile Soccer 5.0.1 – بازی فوتبال “فیفا موبایل” اندروید\n\n\n۹۶/۰۱/۰۶\nآپدیت دانلود Doodle Army 2 : Mini Militia 3.0.87 – بازی اکشن ارتش احمق اندروید + مود\n\n\n\n\n\nمحبوب ترین مطالب\n\n\n\n۹۵/۰۵/۰۲\nدیگر فلش‏ دیسک خود را جا نگذارید!\n\n\n۹۵/۰۴/۲۶\nیک روش ساده اما کارآمد جهت حفاظت از رمز عبور\n\n\n۹۵/۰۵/۰۲\n10 ترفند برای افزایش طول عمر CDها\n\n\n۹۵/۰۵/۰۱\nآموزش ویندوز 10: رفع مشکل ناپدید شدن گزینه Open with در منوی راست کلیک\n\n\n۹۵/۰۵/۰۷\nآموزش استفاده از Google Maps به صورت آفلاین | دانلود آخرین ورژن\n\n\n۹۵/۰۵/۰۵\nآموزش بازگرداندن ویندوز 10 به ویندوز 7 یا 8 یا 8.1 + کاملا تصویری\n\n\n۹۵/۰۴/۲۲\nجلوگیری از دو تکه شدن یک پاراگراف در میان صفحات در Word\n\n\n۹۵/۰۵/۰۲\nنامرئی کردن فولدرها!\n\n\n۹۵/۰۵/۰۵\nافزایش سرعت ویندوز 10 + نکته های طلایی ویندوز 10\n\n\n۹۵/۰۴/۱۹\nافزودن This PC به صفحه‌ی Desktop ویندوز 10\n\n\n\n\n\nپیوندها\n\n\n\nفوتبال جهان\n\n\n\n\n\n\n\n\n\n\nقدرت گرفته از بلاگ بیان\n\n\n\n\n\n\n\n\n\n\n", "post_full_content_4": "\nآپدیت دانلود NBA LIVE Mobile Basketball 1.5.2 – بازی بسکتبال NBA اندروید !\n\n از محبوب ترین و پردانلودترین بازیهای ورزشی بسکتبال از استودیوی مطرح ELECTRONIC ARTS برای اندروید\n است که به صورت رایگان در پلی استور عرضه شده و تا به این لحظه بیش از 50 \nمیلیون بار توسط کاربران اندرویدی سراسر جهان دانلود شده است! بر خلاف \nبازیهای بسکتبال دیگر از جمله NBA 2K 2016 در NBA LIVE Mobile Basketball \nمی بایست با بازیکن های آماتور تیم بسازید و تیم و بازیکن ها را به تدریج و\n با دریافت امتیاز قوی تر کنید! سه حالت مختلف در این بازی دیده می شود، \nیکی اینکه تیم خود را در لیگ چهاره تیمی شرکت می دهید و به مسایقات پلی آف \nمی فرستید تا قهرمان شوید، در واقع همان حالت سنتی بازی های NBA ؛ حالت دوم\n بازی Live Events نام دارد که در آن روزانه چالش هایی برای شما تعریف می \nشود که مهارت بازیتان را بالا می برد و در سومین حالت بازی، یعنی \nhead-to-head، شما کنترل یک بازیکن را در طول یک کواتر بر عهده می گیرید و \nبه صورت آنلاین با یکی که او هم کنترل یک بازیکن را بر عهده دارد بازی می \nکنید! به طور کلی نباید انتظار داشته باشید نسخه موبایل این بازی گرافیک و \nکنترل کنسول های بازی را داشته باشد ؛ گرافیک بازی خوب است، ولی چهره \nبازیکن ها را از نزدیک نمی بینیم ؛ کنترل بازی هم ساده تر است که به همین \nدلیل نسخه موبایل نسخه جذاب تری از آب درآمده است! اگر از علاقه مندان به \nبازیهای بسکتبال اندروید هستید بازی فوق انتخاب مناسبی است!\n\n\n \n\n \nتوجه داشته باشید :\n1 – بازی\n دیتا دارد اما دیتایی از سوی سازنده عرضه نشده و باید از طریق خود بازی \nدانلود صورت بگیرد [حجم دیتای دانلودی چیزی حدود 300 مگابایت است]\n2 – بازی آنلاین است و همیشه به اینترنت نیاز دارد .\n3 – بازی نسخه مود ندارد و دنبال مودش نباشید !\n\n دانلود فایل نصبی اصلی بازی با لینک مستقیم - 63 مگابایت\n\nمنبع:فارسروید \n\n\n\n\n۹۶/۰۱/۱۶\n\n\n\n\n۰\n\n\n\n\n\n۰\n\n\n\n\n\nERFAN Hjizadehe\n\n\n\n\n\n\n\n\n\n\n\n\n\n\nبینندگان عزیز برای رفتن به ادامه مطلب سمت چپ  شکل مثلث را بزنید و وارد شوید .در این وبلاگ بهترین بازی های اندروید و پربازدید ترین بازی ها گذاشته می شود \n\n\n\n\n\n\n\nupdateSearchBoxTheme('srchBx')\n\n\n\n\t\t\t\tدنبال کنندگان\n\t\t\t\t\n\t\t\t\t\t\t۸۳\n\t\t\t\t\tنفر\n\t\t\t\t\n\n\n\n\n\n\n\n\n\n\n\n\n\n\n\n\n\n\n\n\n\n\n\n\n\n\n\n\n\n\n\n\n\n\n\n\n\n\n\n\n\n\n\n\n\n\n\n\n\n\n\n\n\n\n\n\n\n\n\n\n\n\n\n\n\n\t\t\t\tاین وبلاگ را دنبال کنید\n\t\t\t\n\n\n\n\n\nطبقه بندی موضوعی\n\n\n\nترفندهای ویندوزی  (۲۵۹)\n\n\nاستراتژیک  (۵۰)\n\n\nاکشن  (۸۶)\n\n\nمسابقه ای  (۱۷)\n\n\nورزشی  (۲۹)\n\n\nموتور و ماشین  (۳۳)\n\n\nکودکانه  (۲۵)\n\n\nانلاین  (۵۴)\n\n\nماجراجویی  (۸۰)\n\n\nبرنامه های خاص  (۳۸)\n\n\nفکری  (۶۳)\n\n\nترسناک  (۱۱)\n\n\n\n\n\n\nخلاصه آمار\n\n\n\n\n\n\n\n\n\n\nکلمات کلیدی\n\nمشاهده پسورد Wi-Fi ذخیره شده در گوشی های اندروید + آموزش تصویری\nافزایش سرعت ویندوز 10 + نکته های طلایی ویندوز 10\nنمایش روز و تاریخ موجود در صفحه‌ی Lock ویندوز 8 به زبان فارسی\nتشخیص اصل بودن گوشی از طریق اینترنت\nآموزش جلوگیری از هک تلگرام و افزایش امنیت آن\nآموزش روت کردن تمام گوشی های اندروید\nارسال SMS رایگان توسط ایرانسل در مواقع اضطراری!\nنظیماتی برای اجرای بهتر بازی‌ها در ویندوز\nذخیره‌ی نقشه‌های Google Maps برای استفاده‌ی آفلاین در اندروید\n4 راز که هکرهای شبکه‌های وایرلس نمی‌خواهند شما بدانید!\nزودتر از دیگران قابلیت‌های جدید ویندوز 10 را آزمایش کنید\nکاهش حجم اشغال‌شده‌ی درایو C با حذف آپدیت‌های قدیمی\n\n\n\nآخرین مطلب\n\n\n\n۹۶/۰۱/۱۶\nدانلود Age of Empires: Castle Siege 1.23.199 بازی استراتژی خارق العاده “عصر فرمانروایان + دیتا\n\n\n۹۶/۰۱/۱۶\nجدید دانلود Duet Premium Edition 3.8 – بازی آرکید اعتیادآور “دوئت” اندروید + اورجینال\n\n\n۹۶/۰۱/۱۶\nآپدیت دانلود Darkness and Flame Full 1.0.8 – بازی فکری عالی “زاده آتش” اندروید + دیتا\n\n\n۹۶/۰۱/۱۶\nآپدیت دانلود NBA LIVE Mobile Basketball 1.5.2 – بازی بسکتبال NBA اندروید !\n\n\n۹۶/۰۱/۱۶\nآپدیت دانلود Beat the Boss 4 1.1.2 – بازی ضرب و شتم رئیس 4 اندروید + مود + دیتا\n\n\n۹۶/۰۱/۱۶\nآپدیت دانلود Desert Storm 5.0 – بازی اکشن عالی “طوفان صحرا” اندروید + دیتا\n\n\n۹۶/۰۱/۱۶\nآپدیت دانلود FarmVille: Tropic Escape 1.5.579 – بازی شبیه سازی جنگل استوایی اندروید + مود\n\n\n۹۶/۰۱/۱۶\nآپدیت دانلود بازی نظم و آشوب 2 اندروید – Order  Chaos 2: Redemption 1.9.0l\n\n\n۹۶/۰۱/۱۶\nآپدیت دانلود Final kick: Online football 5.7 – بازی پنالتی ضربات نهایی اندروید + مود + دیتا\n\n\n۹۶/۰۱/۱۶\nآپدیت دانلود Warp Shift 1.0.6 – بازی پازل فوق العاده اندروید + مود + دیتا\n\n\n\n\n\nپربیننده ترین مطالب\n\n\n\n۹۵/۱۲/۱۴\nآپدیت دانلود Gardenscapes – New Acres 1.3.4 – بازی جورچین “باغداری” اندروید + مود\n\n\n۹۵/۱۲/۰۱\nبرنامه هک بازی های اندروید بدون نیاز به روت و با روت\n\n\n۹۵/۰۵/۰۶\nحل مشکل ارور سریال تقلبی Fake Serial Number در IDM\n\n\n۹۶/۰۱/۰۶\nآپدیت دانلود Minecraft – Pocket Edition 1.0.6.0 – بازی ماینکرافت اندروید + مود\n\n\n۹۵/۰۵/۰۵\nآیکون پوشه های ویندوز 10 را به تصویر دلخواه تغییر دهید + تصویر\n\n\n۹۶/۰۱/۰۳\nآپدیت دانلود Dream League Soccer 2017 4.02 – بازی لیگ فوتبال رویایی 2017 اندروید + مود + دیتا\n\n\n۹۵/۰۵/۰۹\nآموزش ساخت ربات تلگرام بدون سرور و برنامه نویسی با Zapier و Paquebot\n\n\n۹۶/۰۱/۰۱\nآپدیت دانلود Township 4.6.2 – بازی شبیه ساز مزرعه اندروید + مود\n\n\n۹۶/۰۱/۱۴\nآپدیت دانلود FIFA Mobile Soccer 5.0.1 – بازی فوتبال “فیفا موبایل” اندروید\n\n\n۹۶/۰۱/۰۶\nآپدیت دانلود Doodle Army 2 : Mini Militia 3.0.87 – بازی اکشن ارتش احمق اندروید + مود\n\n\n\n\n\nمحبوب ترین مطالب\n\n\n\n۹۵/۰۵/۰۲\nدیگر فلش‏ دیسک خود را جا نگذارید!\n\n\n۹۵/۰۴/۲۶\nیک روش ساده اما کارآمد جهت حفاظت از رمز عبور\n\n\n۹۵/۰۵/۰۲\n10 ترفند برای افزایش طول عمر CDها\n\n\n۹۵/۰۵/۰۱\nآموزش ویندوز 10: رفع مشکل ناپدید شدن گزینه Open with در منوی راست کلیک\n\n\n۹۵/۰۵/۰۷\nآموزش استفاده از Google Maps به صورت آفلاین | دانلود آخرین ورژن\n\n\n۹۵/۰۵/۰۵\nآموزش بازگرداندن ویندوز 10 به ویندوز 7 یا 8 یا 8.1 + کاملا تصویری\n\n\n۹۵/۰۴/۲۲\nجلوگیری از دو تکه شدن یک پاراگراف در میان صفحات در Word\n\n\n۹۵/۰۵/۰۲\nنامرئی کردن فولدرها!\n\n\n۹۵/۰۵/۰۵\nافزایش سرعت ویندوز 10 + نکته های طلایی ویندوز 10\n\n\n۹۵/۰۴/۱۹\nافزودن This PC به صفحه‌ی Desktop ویندوز 10\n\n\n\n\n\nپیوندها\n\n\n\nفوتبال جهان\n\n\n\n\n\n\n\n\n\n\nقدرت گرفته از بلاگ بیان\n\n\n\n\n\n\n\n\n\n\n"}